Unnamed: 0,Authors,Title,Year,Link,Authors with Affiliations,Abstract
0,François Deliège;Torben Bach Pedersen,Fuzzy Song Sets for Music Warehouses.,2007,https://doi.org/10.5281/zenodo.1415770,"Franc¸ois Deli`ege, Aalborg University, DNK, education;Torben Bach Pedersen, Aalborg University, DNK, education","The emergence of music recommendation systems calls for the development of new data management technologies able to query vast music collections. In this paper, we deﬁne fuzzy song sets and an algebra to manipulate them. We present a music warehouse prototype able to perform efﬁcient nearest neighbor searches in an arbitrary song similarity space. Using fuzzy song sets, the music warehouse offers a practical solution to the all musical data management scenarios provided: song comparisons, user musical preferences and user feedback. We investigate three practical approaches to tackle the storage issues of fuzzy song sets: tables, arrays and bitmaps. Finally, we confront theoretical estimates to concrete implementation results and prove that, from a storage perspective, arrays and bitmaps are both effective data structure solutions."
1,Wei Peng 0001;Tao Li 0001;Mitsunori Ogihara,Music Clustering with Constraints.,2007,https://doi.org/10.5281/zenodo.1418087,"Wei Peng, Florida International University, USA, education;Tao Li, Florida International University, USA, education;Mitsunori Ogihara, University of Rochester, USA, education","This paper studies the problem of building clusters of music tracks in a collection of popular music in the presence of constraints. The constraints come naturally in the context of music applications. For example, constraints can be generated from the background knowledge (e.g., two artists share similar styles) and the user access patterns (e.g., two pieces of music share similar access patterns across multiple users). We present an approach based on the generalized constraint clustering algorithm by incorporating the constraints for grouping music by “similar” artists. The approach is evaluated on a data set consisting of 53 albums covering 41 popular artists. The “correctness” of the clusters generated is tested using artist similarity provided by All Music Guide."
2,Geoffroy Peeters,Sequence Representation of Music Structure Using Higher-Order Similarity Matrix and Maximum-Likelihood Approach.,2007,https://doi.org/10.5281/zenodo.1416748,"Geoffroy Peeters, Ircam Sound Analysis/Synthesis Team - CNRS STMS, FRA, facility","In this paper, we present a novel method for the automatic estimation of the structure of music tracks using a sequence representation. A set of timbre-related (MFCC and Spectral Contrast) and pitch-related (Pitch Class Profile) features are first extracted from the signal leading to three similarity matrices which are then combined. We then introduce the use of higher-order (2nd and 3rd order) similarity matrices in order to reinforce the diagonals corresponding to common repetitions and reduce the background noise. Segments are then detected and a maximum-likelihood approach is proposed in order to derive simultaneously the underlying sequence representation of the music track and the most representative segment of each sequence. The proposed method is evaluated positively on the MPEG-7 “melody repetition” test set."
3,Christophe Rhodes;Michael A. Casey,Algorithms for Determining and Labelling Approximate Hierarchical Self-Similarity.,2007,https://doi.org/10.5281/zenodo.1418095,"Christophe Rhodes, Goldsmiths University of London, GBR, education;Michael Casey, Goldsmiths University of London, GBR, education","We describe an algorithm for finding approximate sequence similarity at all scales of interest, being explicit about our modelling assumptions and the parameters of the algorithm. We further present an algorithm for producing section labels based on the sequence similarity, and compare these labels with some expert-provided ground truth for a particular set of recordings."
4,Meinard Müller;Michael Clausen,Transposition-Invariant Self-Similarity Matrices.,2007,https://doi.org/10.5281/zenodo.1414814,"Meinard Müller, Bonn University, DEU, education;Michael Clausen, Bonn University, DEU, education","Self-similarity matrices have become an important tool for visualizing the repetitive structure of a music recording. Transforming an audio data stream into a feature sequence, one obtains a self-similarity matrix by pairwise comparing all features of the sequence with respect to a local cost measure. The basic idea is that similar audio segments are revealed as paths of low cost along diagonals in the resulting self-similarity matrix. It is often the case, in particular for classical music, that certain musical parts are repeated in another key. In this paper, we introduce the concept of a transposition-invariant self-similarity matrix, which reveals the repetitive structure even in the presence of key transpositions. Furthermore, we introduce an associated transposition index matrix displaying harmonic relations within the music recording. As an application, we sketch how our concept can be used for the task of audio structure analysis."
5,Douglas Turnbull;Gert R. G. Lanckriet;Elias Pampalk;Masataka Goto,A Supervised Approach for Detecting Boundaries in Music Using Difference Features and Boosting.,2007,https://doi.org/10.5281/zenodo.1415082,"Douglas Turnbull, University of California, San Diego, USA, education;Gert Lanckriet, University of California, San Diego, USA, education;Elias Pampalk, National Institute of Advanced Industrial Science and Technology (AIST), JPN, facility;Masataka Goto, National Institute of Advanced Industrial Science and Technology (AIST), JPN, facility","A musical boundary is a transition between two musical segments such as a verse and a chorus. Our goal is to automatically detect musical boundaries using temporally-local audio features. We develop a set of difference features that indicate when there are changes in perceptual aspects (e.g., timbre, harmony, melody, rhythm) of the music. We show that many individual difference features are useful for detecting boundaries. By combining these features and formulating the problem as a supervised learning problem, we can further improve performance. This is an alternative to previous work on music segmentation which has focused on unsupervised approaches based on notions of self-similarity computed over an entire song. We evaluate performance using a publicly available data set of 100 copyright-cleared pop/rock songs, each of which has been segmented by a human expert."
6,Alan Marsden,Automatic Derivation of Musical Structure: A Tool for Research on Schenkerian Analysis.,2007,https://doi.org/10.5281/zenodo.1415814,"Alan Marsden, Lancaster Institute for the Contemporary Arts, Lancaster University, UK, education","""This paper describes software to facilitate research on the automatic derivation of hierarchical (Schenkerian) musical structures from a musical surface. Many MIR tasks require information about musical structure, or would perform better if such information were available. Automatic derivation of musical structure faces two significant obstacles. Firstly, the solution space of possible structural analyses of a piece is very large. Secondly, pieces can have more than one valid structural analysis, and there is little firm agreement among music theorists about how to distinguish a good analysis. To circumvent the first of these obstacles, software has been developed which derives a tractable ‘matrix’ of possibilities from a musical surface (i.e., MIDI-like note-time information). The matrix is somewhat like the intermediate results of a dynamic-programming algorithm, and in a similar way it is possible to extract a particular structural analysis from the matrix by following the appropriate path from the top level to the surface. It therefore provides a tool to facilitate research on the second obstacle by allowing candidate ‘goodness’ metrics to be incorporated into the software and tested on actual music."""
7,Thomas Lidy;Andreas Rauber;Antonio Pertusa;José Manuel Iñesta Quereda,Improving Genre Classification by Combination of Audio and Symbolic Descriptors Using a Transcription Systems.,2007,https://doi.org/10.5281/zenodo.1416344,"Thomas Lidy, Vienna University of Technology, Austria, education;Andreas Rauber, Vienna University of Technology, Austria, education;Antonio Pertusa, University of Alicante, Spain, education;José Manuel Iñesta, University of Alicante, Spain, education","""Recent research in music genre classification hints at a glass ceiling being reached using timbral audio features. To overcome this, the combination of multiple different feature sets bearing diverse characteristics is needed. We propose a new approach to extend the scope of the features: We transcribe audio data into a symbolic form using a transcription system, extract symbolic descriptors from that representation and combine them with audio features. With this method, we are able to surpass the glass ceiling and to further improve music genre classification, as shown in the experiments through three reference music databases and comparison to previously published performance results."""
8,Xiao Hu 0001;J. Stephen Downie,"Exploring Mood Metadata: Relationships with Genre, Artist and Usage Metadata.",2007,https://doi.org/10.5281/zenodo.1415126,"Xiao Hu, University of Illinois at Urbana-Champaign, USA, education;J. Stephen Downie, University of Illinois at Urbana-Champaign, USA, education","""There is a growing interest in developing and then evaluating Music Information Retrieval (MIR) systems that can provide automated access to the mood dimension of music. Mood as a music access feature, however, is not well understood in that the terms used to describe it are not standardized and their application can be highly idiosyncratic. To better understand how we might develop methods for comprehensively developing and formally evaluating useful automated mood access techniques, we explore the relationships that mood has with genre, artist and usage metadata. Statistical analyses of term interactions across three metadata collections (AllMusicGuide.com, epinions.com and Last.fm) reveal important consistencies within the genre-mood and artist-mood relationships. These consistencies lead us to recommend a cluster-based approach that overcomes specific term-related problems by creating a relatively small set of data-derived “mood spaces” that could form the ground-truth for a proposed MIREX “Automated Mood Classification” task."""
9,Alastair J. D. Craft;Geraint A. Wiggins;Tim Crawford,How Many Beans Make Five? The Consensus Problem in Music-Genre Classification and a New Evaluation Method for Single-Genre Categorisation Systems.,2007,https://doi.org/10.5281/zenodo.1414982,"Alastair J. D. Craft, Goldsmiths, University of London, GBR, education;Geraint A. Wiggins, Goldsmiths, University of London, GBR, education;Tim Crawford, Goldsmiths, University of London, GBR, education","""Genre deﬁnition and attribution is generally considered to be subjective. This makes evaluation of any genre- labelling system intrinsically difﬁcult, as the ground-truth against which it is compared is based upon subjective responses, with little inter-participant consensus. This paper presents a novel method of analysing the results of a genre-labelling task, and demonstrates that there are groups of genre-labelling behaviour which are self- consistent. It is proposed that the evaluation of any genre classiﬁcation system uses this modiﬁed analysis method."""
10,Christopher DeCoro;Zafer Barutçuoglu;Rebecca Fiebrink,Bayesian Aggregation for Hierarchical Genre Classification.,2007,https://doi.org/10.5281/zenodo.1416012,"Christopher DeCoro, Princeton University, USA, education;Zafer Barutcuoglu, Princeton University, USA, education;Rebecca Fiebrink, Princeton University, USA, education","Hierarchical taxonomies of classes arise in the analysis of many types of musical information, including genre, as a means of organizing overlapping categories at varying levels of generality. However, incorporating hierarchical structure into conventional machine learning systems presents a challenge: the use of independent binary classifiers for each class in the hierarchy can produce hierarchically inconsistent predictions. That is, an example may be assigned to a class, and not assigned to the parent of that class. This paper applies a Bayesian framework to combine, or aggregate, a hierarchy of multiple binary classifiers in a principled manner, and consequently improves performance over the hierarchy as a whole. Furthermore, such an approach allows for an arbitrarily complex hierarchy, and does not suffer from classes that are too broad or too refined. Experiments on the MIREX 2005 symbolic genre classification dataset show that our Bayesian Aggregation algorithm provides significant improvement over independent classifiers, and demonstrates superior performance compared to previous work. Our method also improves similarity search by ranking songs by similarity of hierarchical predictions to those of a query song."
11,Sally Jo Cunningham;David Bainbridge 0001;Dana McKay,Finding New Music: A Diary Study of Everyday Encounters with Novel Songs.,2007,https://doi.org/10.5281/zenodo.1417083,"Sally Jo Cunningham, University of Waikato, NZL, education;David Bainbridge, University of Waikato, NZL, education;Dana McKay, Swinburne University of Technology, AUS, education","""This paper explores how we, as individuals, purposefully or serendipitously encounter “new music” (that is, music that we haven’t heard before) and relates these behaviours to music information retrieval activities such as music searching and music discovery via use of recommender systems. 41 participants participated in a three-day diary study, in which they recorded all incidents that brought them into contact with new music. The diaries were analyzed using a Grounded Theory approach. The results of this analysis are discussed with respect to location, time, and whether the music encounter was actively sought or occurred passively. Based on these results, we outline design implications for music information retrieval software, and suggest an extension of “laid back” searching."""
12,Kazuyoshi Yoshii;Masataka Goto;Kazunori Komatani;Tetsuya Ogata;Hiroshi G. Okuno,Improving Efficiency and Scalability of Model-Based Music Recommender System Based on Incremental Training.,2007,https://doi.org/10.5281/zenodo.1416880,"Kazuyoshi Yoshii, Graduate School of Informatics, Kyoto University, JPN, education, JSPS Research Fellow (DC1), JPN, facility;Masataka Goto, National Institute of Advanced Industrial Science and Technology (AIST), JPN, facility;Kazunori Komatani, Graduate School of Informatics, Kyoto University, JPN, education;Tetsuya Ogata, Graduate School of Informatics, Kyoto University, JPN, education;Hiroshi G. Okuno, Graduate School of Informatics, Kyoto University, JPN, education","We aimed at improving the efﬁciency and scalability of a hybrid music recommender system based on a proba- bilistic generative model that integrates both collaborative data (rating scores provided by users) and content-based data (acoustic features of musical pieces). Although the hybrid system was proved to make accurate recommen- dations, it lacks efﬁciency and scalability. In other words, the entire model needs to be re-trained from scratch when- ever a new score, user, or piece is added. Furthermore, the system cannot deal with practical numbers of users and pieces on an enterprise scale. To improve efﬁciency, we propose an incremental method that partially updates the model at low computational cost. To enhance scalability, we propose a method that ﬁrst constructs a small “core” model over fewer virtual representatives created from real users and pieces, and then adds the real users and pieces to the core model by using the incremental method. The ex- perimental results revealed that the proposed system was not only efﬁcient and scalable but also outperformed the original system in terms of accuracy."
13,Amelie Anglade;Marco Tiemann;Fabio Vignoli,Virtual Communities for Creating Shared Music Channels.,2007,https://doi.org/10.5281/zenodo.1414710,"Amélie Anglade, Philips Research Europe, NLD, company;Marco Tiemann, Philips Research Europe, NLD, company;Fabio Vignoli, Philips Research Europe, NLD, company","We present an approach to automatically create virtual communities of users with similar music tastes. Our goal is to create personalized music channels for these communities in a distributed way, so that they can for example be used in peer-to-peer networks. To ﬁnd suitable techniques for creating these communities we analyze graphs created from real-world recommender datasets and identify speciﬁc properties of these datasets. Based on these properties we select and evaluate different graph-based community-extraction techniques. We select a technique that exploits identiﬁed properties to create clusters of music listeners. We validate the suitability of this technique using a music dataset and a large movie dataset. On a graph of 6,040 peers, the selected technique assigns at least 85% of the peers to optimal communities, and obtains a mean classiﬁcation error of less than 0.05 over the remaining peers that are not assigned to the best community."
14,Elias Pampalk;Masataka Goto,MusicSun: A New Approach to Artist Recommendation.,2007,https://doi.org/10.5281/zenodo.1417487,"Elias Pampalk, National Institute of Advanced Industrial Science and Technology (AIST), JPN, facility;Masataka Goto, National Institute of Advanced Industrial Science and Technology (AIST), JPN, facility",MusicSun is a graphical user interface to discover artists. Artists are recommended based on one or more artists selected by the user. The recommendations are computed by combining 3 different aspects of similarity. The users can change the impact of each of these aspects. In addition words are displayed which describe the artists selected by the user. The user can select one of these words to focus the search on a specific direction.
15,Jesper Højvang Jensen;Daniel P. W. Ellis;Mads Græsbøll Christensen;Søren Holdt Jensen,Evaluation of Distance Measures Between Gaussian Mixture Models of MFCCs.,2007,https://doi.org/10.5281/zenodo.1415752,"Jesper Højvang Jensen, Aalborg University, DNK, education;Daniel P.W. Ellis, Columbia University, USA, education;Mads G. Christensen, Aalborg University, DNK, education;Søren Holdt Jensen, Aalborg University, DNK, education","""In music similarity and in the related task of genre classification, a distance measure between Gaussian mixture models is frequently needed. We present a comparison of the Kullback-Leibler distance, the earth movers distance and the normalized L2 distance for this application. Although the normalized L2 distance was slightly inferior to the Kullback-Leibler distance with respect to classification performance, it has the advantage of obeying the triangle inequality, which allows for efficient searching."""
16,Carlos Gómez;Soraya Abad-Mota;Edna Ruckhaus,An Analysis of the Mongeau-Sankoff Algorithm for Music Information Retrieval.,2007,https://doi.org/10.5281/zenodo.1417931,"Carlos Gómez, Universidad Simón Bolívar, VEN, education;Soraya Abad-Mota, Universidad Simón Bolívar, VEN, education;Edna Ruckhaus, Universidad Simón Bolívar, VEN, education","An essential problem in music information retrieval is to determine the similarity between two given melodies; there are several melodic similarity measures that have been proposed, among others, the Mongeau-Sankoff measure. In this work we implemented a modiﬁed version of the Mongeau-Sankoff measure. We conducted an experimental study to compare the implemented measure with other similarity measures; this evaluation was done in the context of the 2005 edition of the MIREX symbolic melodic similarity competition. The most relevant result of our work is an implementation of the Mongeau-Sankoff measure that presents greater effectiveness when compared to other current melodic similarity measures."
17,Alberto Novello;Martin F. McKinney,Assessment of Perceptual Music Similarity.,2007,https://doi.org/10.5281/zenodo.1415050,"Alberto Novello, Philips Research Laboratories, Eindhoven, NLD, facility;Martin McKinney, Philips Research Laboratories, Eindhoven, NLD, facility","""This paper extends a study on music similarity perception presented at ISMIR last year, in which subjects ranked the similarity of excerpt-pairs presented in triads [1]. The larger number of subjects and stimuli in the current study required a modiﬁcation of the methodological strategy. We use here two nested incomplete block designs in order to cover the full set of song-excerpts comparisons (tri- ads) while limiting the experimental time per subject. In addition to the two variable factors of the previous experiment, tempo and genre, we examine here the effect of prevalent instrument timbre. We found that 69 of 78 subjects where signiﬁcantly consistent in their judgments of repeated triads. Furthermore, we found signiﬁcant across- subject consistency on all 10 repeated triads. A signif- icant difference was found in the distributions of inter- and intra-genre excerpt distances. The stress values in the Shepard’s plot shows evidence of increased complexity in the present study compared to the previous smaller study."""
18,Cory McKay;Ichiro Fujinaga,jWebMiner: A Web-Based Feature Extractor.,2007,https://doi.org/10.5281/zenodo.1417679,"Cory McKay, McGill University, CAN, education;Ichiro Fujinaga, McGill University, CAN, education","jWebMiner is a software package for extracting cultural features from the web. It is designed to be used for arbitrary types of MIR research, either as a stand-alone application or as part of the jMIR suite. It emphasizes extensibility, generality and an easy-to-use interface. At its most basic level, the software operates by using web services to extract hit counts from search engines. Functionality is available for calculating a variety of statistical features based on these counts, for variably weighting web sites or limiting searches only to particular sites, for excluding hits that do not contain particular filter terms, for defining synonym relationships between certain search strings, and for applying a number of additional search configurations."
19,Tim Pohle;Peter Knees;Markus Schedl;Gerhard Widmer,Meaningfully Browsing Music Services.,2007,https://doi.org/10.5281/zenodo.1417777,"Tim Pohle, Johannes Kepler University, AUT, education;Peter Knees, Johannes Kepler University, AUT, education;Markus Schedl, Johannes Kepler University, AUT, education;Gerhard Widmer, Johannes Kepler University, AUT, education, Austrian Research Institute for Artificial Intelligence (OFAI), AUT, facility","""We present a browser application that offers the user an enhanced access to the content of music web services. Most importantly, the technique we apply aims at making it feasible to add to the automated suggestion of similar artists some intentional spin, or direction. At the heart of the algorithm, automatically derived artist descriptions are analyzed for common topics or aspects, and each artist is described by the extent to which it is associated with each of these topics. The browser application enables the user to formulate a query by means of these underlying topics by simply adjusting slider positions. The best matching artist is shown, and its web page found on the web music service is displayed."""
20,Markus Schedl;Gerhard Widmer;Tim Pohle;Klaus Seyerlehner,Web-Based Detection of Music Band Members and Line-Up.,2007,https://doi.org/10.5281/zenodo.1418325,"Markus Schedl, Johannes Kepler University, AUT, education;Gerhard Widmer, Johannes Kepler University, AUT, education; Austrian Research Institute for Artificial Intelligence, AUT, facility;Tim Pohle, Johannes Kepler University, AUT, education;Klaus Seyerlehner, Johannes Kepler University, AUT, education","We present ﬁrst steps towards the automatic detection of music band members and instrumentation using web content mining techniques. To this end, we combine a named entity detection method with rule-based linguistic text analysis. We report on preliminary evaluation results and discuss limitations of the current method."
21,Gijs Geleijnse;Jan H. M. Korst,Tool Play Live: Dealing with Ambiguity in Artist Similarity Mining from the Web.,2007,https://doi.org/10.5281/zenodo.1416430,"Gijs Geleijnse, Philips Research, NLD, facility;Jan Korst, Philips Research, NLD, facility","As methods in artist similarity identification using Web Music Information Retrieval perform well on known evaluation sets, we investigate the application of such a method to a more realistic data set. We notice that ambiguous artist names lead to unsatisfying results. We present a simple, efficient and unsupervised method to deal with ambiguous artist names."
22,Bin Wei;Chengliang Zhang;Mitsunori Ogihara,Keyword Generation for Lyrics.,2007,https://doi.org/10.5281/zenodo.1418369,"Bin Wei, U. Rochester, USA, education;Chengliang Zhang, U. Rochester, USA, education;Mitsunori Ogihara, U. Rochester, USA, education",This paper proposes a scheme for content based keyword generation of song lyrics. Syntactic as well semantic similarity is used for sentence level clustering to separate the topic from the background of a song. A method is proposed to search for a center in the semantic graph of WordNet for generating keywords not contained in original text.
