Unnamed: 0,Authors,Title,Year,Link,Authors with Affiliations,Abstract
0,E. Allamanche;Jürgen Herre;Oliver Hellmuth;T. Kastner;C. Ertel,A multiple feature model for musical similarity retrieval.,2003,https://doi.org/10.5281/zenodo.1416684,"Eric Allamanche, Fraunhofer Institut Integrierte Schaltungen, IIS, DEU, facility;J¨urgen Herre, Fraunhofer Institut Integrierte Schaltungen, IIS, DEU, facility;Oliver Hellmuth, Fraunhofer Institut Integrierte Schaltungen, IIS, DEU, facility;Thorsten Kastner, Fraunhofer Institut Integrierte Schaltungen, IIS, DEU, facility;Christian Ertel, Fraunhofer Institut Integrierte Schaltungen, IIS, DEU, facility","""Despite the “fuzzy” nature of musical similarity, which varies from one person to another, perceptual low level features combined with appropriate classi- ﬁcation schemes have proven to perform satisfactorily for this task. Since a single feature only captures some selective characteristics of an audio signal, this information may, in some cases, not be sufﬁcient to properly identify similarities between songs. This pa- per presents a system which combines a set of acous- tic features for the task of retrieving similar sounding songs. The methodology for optimum feature selec- tion and combination is explained, and the system’s performance is assessed by means of a subjective lis- tening test."""
1,Vlora Arifi;Michael Clausen;Frank Kurth;Meinard Müller,"Automatic synchronization of music data in score-, MIDI- and PCM-format.",2003,https://doi.org/10.5281/zenodo.1417848,"Vlora Ariﬁ, Universität Bonn, Institut für Informatik III, DEU, education;Michael Clausen, Universität Bonn, Institut für Informatik III, DEU, education;Frank Kurth, Universität Bonn, Institut für Informatik III, DEU, education;Meinard Müller, Universität Bonn, Institut für Informatik III, DEU, education","""In this paper we present algorithms for the automatic time-synchronizationof score-, MIDI- or PCM- data streams representing the same polyphonic piano piece."""
2,David Bainbridge 0001;Sally Jo Cunningham;J. Stephen Downie,Analysis of queries to a Wizard-of-Oz MIR system: Challenging assumptions about what people really want.,2003,https://doi.org/10.5281/zenodo.1416850,"David Bainbridge, University of Waikato, NZL, education;Sally Jo Cunningham, University of Waikato, NZL, education;J. Stephen Downie, University of Illinois at Urbana-Champaign, USA, education","How do users of music information retrieval (MIR)
systems express their needs? Using a Wizard of Oz
approach to system evaluation, combined with a
grounded theory analysis of 502 real-world music
queries posted to Google Answers, this paper
addresses this pivotal question."
3,Adam Berenzweig;Beth Logan;Daniel P. W. Ellis;Brian Whitman,A large-scale evalutation of acoustic and subjective music similarity measures.,2003,https://doi.org/10.5281/zenodo.1417010,"Adam Berenzweig, LabROSA, Columbia University, USA, education;Beth Logan, HP Labs, USA, company;Daniel P.W. Ellis, LabROSA, Columbia University, USA, education;Brian Whitman, Music Mind & Machine Group, MIT Media Lab, USA, education","Subjective similarity between musical pieces and artists is an elusive concept, but one that must be pursued in support of applications to provide automatic organization of large music collections. In this paper, we examine both acoustic and subjective approaches for calculating similarity between artists, comparing their performance on a common database of 400 popular artists. Specifically, we evaluate acoustic techniques based on Mel-frequency cepstral coefficients and an intermediate ‘anchor space’ of genre classification, and subjective techniques which use data from The All Music Guide, from a survey, from playlists and personal collections, and from web-text mining. We find the following: (1) Acoustic-based measures can achieve agreement with ground truth data that is at least comparable to the internal agreement between different subjective sources. However, we observe significant differences between superficially similar distribution modeling and comparison techniques. (2) Subjective measures from diverse sources show reasonable agreement, with the measure derived from co-occurrence in personal music collections being the most reliable overall. (3) Our methodology for large-scale cross-site music similarity evaluations is practical and convenient, yielding directly comparable numbers for different approaches. In particular, we hope that our information-retrieval-based approach to scoring similarity measures, our paradigm of sharing common feature representations, and even our particular dataset of features for 400 artists, will be useful to other researchers."
4,Elaine Chew;Yun-Ching Chen,Determining context-defining windows: Pitch spelling using the spiral array.,2003,https://doi.org/10.5281/zenodo.1418037,"Elaine Chew, University of Southern California, USA, education;Yun-Ching Chen, University of Southern California, USA, education","""This paper presents algorithms for pitch spelling using the Spiral Array model. Accurate pitch spelling, assigning contextually consistent letter names to pitch numbers (for example, MIDI), is a critical component of music transcription and analysis systems. The local context is found to be more important than the global, but a combination of both achieves the best results."""
5,Roger B. Dannenberg;William P. Birmingham;George Tzanetakis;Colin Meek;Ning Hu;Bryan Pardo,The MUSART testbed for query-by-humming evaluation.,2003,https://doi.org/10.5281/zenodo.1415978,"Roger B. Dannenberg, Carnegie Mellon University, USA, education;William P. Birmingham, University of Michigan, USA, education;George Tzanetakis, University of Michigan, USA, education;Colin Meek, Carnegie Mellon University, USA, education;Ning Hu, Carnegie Mellon University, USA, education;Bryan Pardo, Carnegie Mellon University, USA, education","Evaluating music information retrieval systems is acknowledged to be a difficult problem. We have created a database and a software testbed for the systematic evaluation of various query-by-humming (QBH) search systems. As might be expected, different queries and different databases lead to wide variations in observed search precision. “Natural” queries from two sources led to lower performance than that typically reported in the QBH literature. These results point out the importance of careful measurement and objective comparisons to study retrieval algorithms. This study compares search algorithms based on note-interval matching with dynamic programming, fixed-frame melodic contour matching with dynamic time warping, and a hidden Markov model. An examination of scaling trends is encouraging: precision falls off very slowly as the database size increases. This trend is simple to compute and could be useful to predict performance on larger databases."
6,Stephen Davison,The Sheet Music Consortium: A Specialized Open Archives Initiative harvester project.,2003,https://doi.org/10.5281/zenodo.1417731,"Stephen Davison, University of California, Los Angeles, USA, education;Cynthia Requardt, The Johns Hopkins University, USA, education;Kristine Brancolini, Indiana University, USA, education","The Open Archives Initiative (OAI) Sheet Music Project is a consortium of institutions building OAI-compliant data providers, a metadata harvester, and a web-based service provider for digital sheet music collections. The project aims to test the viability of the OAI standard for providing access to sheet music collections on the web, and to build a permanent and increasingly participatory service for the discovery of digital sheet music. The service provider design has been informed by detailed usability testing, and by limitations imposed by the variations in metadata harvested from the different participating collections. Advanced services in addition to basic searching and browsing have been developed, including the ability to save and share subsets across participating collections. Harvesting and searching strategies for overcoming metadata limitations are being developed. The consortium is seeking additional participants with digital sheet music collections, and is exploring the possibility of incorporating scores and audio into the project."
7,Tom De Mulder;Jean-Pierre Martens;Micheline Lesaffre;Marc Leman;Bernard De Baets,An auditory model based transriber of vocal queries.,2003,https://doi.org/10.5281/zenodo.1416492,"Tom De Mulder, Ghent University, BEL, education;Jean-Pierre Martens, Ghent University, BEL, education;Micheline Lesaffre, Ghent University, BEL, education;Marc Leman, Ghent University, BEL, education;Bernard De Baets, Ghent University, BEL, education;Hans De Meyer, Ghent University, BEL, education","""In this paper a new auditory model-based transcriber of vocal melodic queries is presented. Our experiments show that the new system can transcribe queries with an accuracy between 76 % (whistling) and 85 % (singing with syllables), and that it outperforms four state-of-the-art systems it was compared with."""
8,Simon Dixon;Elias Pampalk;Gerhard Widmer,Classification of dance music by periodicity patterns.,2003,https://doi.org/10.5281/zenodo.1414936,"Simon Dixon, Austrian Research Institute for AI, AUT, facility;Elias Pampalk, Austrian Research Institute for AI, AUT, facility;Gerhard Widmer, Austrian Research Institute for AI, AUT, facility, Department of Medical Cybernetics and AI, University of Vienna, AUT, education","""This paper addresses the genre classiﬁcation prob-
lem for a speciﬁc subset of music, standard and Latin
ballroom dance music, using a classiﬁcation method
based only on timing information.
We compare
two methods of extracting periodicities from audio
recordings in order to ﬁnd the metrical hierarchy and
timing patterns by which the style of the music can
be recognised: the ﬁrst method performs onset detec-
tion and clustering of inter-onset intervals; the sec-
ond uses autocorrelation on the amplitude envelopes
of band-limited versions of the signal as its method
of periodicity detection. The relationships between
periodicities are then used to ﬁnd the metrical hierar-
chy and to estimate the tempo at the beat and measure
levels of the hierarchy. The periodicities are then in-
terpreted as musical note values, and the estimated
tempo, meter and the distribution of periodicities are
used to predict the style of music using a simple set
of rules. The methods are evaluated with a test set of
standard and Latin dance music, for which the style
and tempo are given on the CD cover, providing a
“ground truth” by which the automatic classiﬁcation
can be measured."""
9,Shyamala Doraisamy;Stefan M. Rüger,Position Indexing of Adjacent and Concurrent N-Grams for Polyphonic Music Retrieval.,2003,https://doi.org/10.5281/zenodo.1417919,"Shyamala Doraisamy, Imperial College London, GBR, education;Stefan Rüger, Imperial College London, GBR, education","In this paper we examine the retrieval performance of adjacent and concurrent n-grams generated from polyphonic music data.  We deploy a method to index polyphonic music using a word position indexer with the n-gram approach.  Using all possible combinations of monophonic sequences from polyphonic music data, “overlaying” word locations within a document are obtained, such as needed with polyphony (i.e. where more than one word can assume the same word position).  The feasibility in utilising the position information of polyphonic ‘musical words’ is investigated using various proximity-based and structured query operators available with text retrieval system.  Our experiments show that nested phrase operators improve the retrieval performance and we present the results of our comparative study on a collection of 5456 polyphonic pieces encoded in the MIDI format."
10,J. Stephen Downie,Toward the scientific evaluation of music information retrieval systems.,2003,https://doi.org/10.5281/zenodo.1417121,"J. Stephen Downie, Graduate School of Library and Information Science, University of Illinois at Urbana-Champaign, USA, education","""This paper outlines the findings-to-date of a project to assist in the efforts being made to establish a TREC-like evaluation paradigm within the Music Information Retrieval (MIR) research community. The findings and recommendations are based upon expert opinion garnered from members of the Information Retrieval (IR), Music Digital Library (MDL) and MIR communities with regard to the construction and implementation of scientifically valid evaluation frameworks. Proposed recommendations include the creation of data-rich query records that are both grounded in real-world requirements and neutral with respect to retrieval technique(s) being examined; adoption, and subsequent validation, of a “reasonable person” approach to “relevance” assessment; and, the development of a secure, yet accessible, research environment that allows researchers to remotely access the large-scale testbed collection."""
11,Jana Eggink;Guy J. Brown,Application of missing feature theory to the recognition of musical instruments in polyphonic audio.,2003,https://doi.org/10.5281/zenodo.1416262,"Jana Eggink, University of Sheffield, GBR, education;Guy J. Brown, University of Sheffield, GBR, education","""A system for musical instrument recognition based on a Gaussian Mixture Model (GMM) classifier is introduced. To enable instrument recognition when more than one sound is present at the same time, ideas from missing feature theory are incorporated. Specifically, frequency regions that are dominated by energy from an interfering tone are marked as unreliable and excluded from the classification process. The approach has been evaluated on clean and noisy monophonic recordings, and on combinations of two instrument sounds. These included random chords made from two isolated notes and combinations of two realistic phrases taken from commercially available compact discs. Classification results were generally good, not only when the decision between reliable and unreliable features was based on the knowledge of the clean signal, but also when it was solely based on the harmonic overtone series of the interfering sound."""
12,Olivier Gillet;Gaël Richard,Automatic labeling of tabla signals.,2003,https://doi.org/10.5281/zenodo.1418281,"Olivier K. GILLET, GET-ENST (TELECOM Paris), FRA, education;Ga¨el RICHARD, GET-ENST (TELECOM Paris), FRA, education","Most of the recent developments in the ﬁeld of music indexing and music information retrieval are focused on western music. In this paper, we present an automatic music transcription system dedicated to Tabla - a North Indian percussion instrument. Our approach is based on three main steps: ﬁrstly, the audio signal is segmented in adjacent segments where each segment represents a single stroke. Secondly, rhythmic information such as relative durations are calculated using beat detection techniques. Finally, the transcription (recognition of the strokes) is performed by means of a statistical model based on Hidden Markov Model (HMM). The structure of this model is designed in order to represent the time dependencies between successives strokes and to take into account the speciﬁcities of the tabla score notation (transcription symbols may be context dependent). Realtime transcription of Tabla soli (or performances) with an error rate of 6.5% is made possible with this transcriber. The transcription system, along with some additional features such as sound synthesis or phrase correction, are integrated in a user-friendly environment called Tablascope."
13,Masataka Goto,Music scene description project: Toward audio-based real-time music understanding.,2003,https://doi.org/10.5281/zenodo.1415684,"Masataka Goto, National Institute of Advanced Industrial Science and Technology (AIST), JPN, facility","""This paper reports a research project intended to build a real-time music-understanding system producing intuitively meaningful descriptions of real-world musical audio signals, such as the melody lines and chorus sections. This paper also introduces our efforts to add correct descriptions (metadata) to the pieces in a music database."""
14,Masataka Goto;Hiroki Hashiguchi;Takuichi Nishimura;Ryuichi Oka,RWC Music Database: Music genre database and musical instrument sound database.,2003,https://doi.org/10.5281/zenodo.1415536,"Masataka Goto, National Institute of Advanced Industrial Science and Technology (AIST), JPN, facility, Information and Human Activity, PRESTO, JST, JPN, facility;Hiroki Hashiguchi, Mejiro University, JPN, education;Takuichi Nishimura, National Institute of Advanced Industrial Science and Technology (AIST), JPN, facility;Ryuichi Oka, University of Aizu, JPN, education","This paper describes the design policy and speciﬁcations of the RWC Music Database, a copyright-cleared mu- sic database (DB) compiled speciﬁcally for research pur- poses. Shared DBs are common in other research ﬁelds and have made signiﬁcant contributions to progress in those ﬁelds. The ﬁeld of music information processing, however, has lacked a common DB of musical pieces or a large-scale DB of musical instrument sounds. We therefore recently constructed the RWC Music Database comprising four original component DBs: Popular Mu- sic Database (100 pieces), Royalty-Free Music Database (15 pieces), Classical Music Database (50 pieces), and Jazz Music Database (50 pieces). In this paper we re- port the construction of two additional component DBs: Music Genre Database (100 pieces) and Musical Instru- ment Sound Database (50 instruments). It is our hope that our DB will make a signiﬁcant contribution to future advances in the ﬁeld of music information processing."
15,S. Harford,"Automatic segmentation, learning and retrieval of melodies using a self-organizing neural network.",2003,https://doi.org/10.5281/zenodo.1416182,"Steven Harford, Dublin City University, IRL, education","We introduce a neural network, known as SONNET-
MAP, capable of automatic segmentation, learning
and retrieval of melodies. SONNET-MAP is a syn-
thesis of the SONNET (Self-Organizing Neural NET-
work) architecture (Nigrin, 1993) and an associa-
tive map derived from ARTMAP (Carpenter, Gross-
berg, and Reynolds, 1991). SONNET-MAP automat-
ically segments a melody based on pitch and rhythmic
grouping cues. Separate SONNET modules represent
the pitch and rhythm dimensions of each segmented
phrase independently, with two associative maps fus-
ing these representations at the phrase level. Further
SONNET modules aggregate these phrases forming a
hierarchical memory structure that encompasses the
entire melody. In addition, melodic queries may be
used to retrieve any encoded melody. As far as we
are aware, SONNET-MAP is the ﬁrst self-organizing
neural network architecture capable of automatically
segmenting and retrieving melodies based on both
pitch and rhythm."
16,Sung-Phil Heo;Motoyuki Suzuki;Akinori Ito;Shozo Makino,Three-dimensional continuous DP algorithm for multiple pitch candidates in a music information retrieval system.,2003,https://doi.org/10.5281/zenodo.1416862,"Sung-Phil HEO, Graduate School of Information Sciences Tohoku University, JPN, education;Motoyuki SUZUKI, Graduate School of Engineering Tohoku University, JPN, education;Akinori ITO, Graduate School of Engineering Tohoku University, JPN, education;Shozo MAKINO, Graduate School of Engineering Tohoku University, JPN, education","This paper treats theoretical and practical issues that implement a music information retrieval system based on query by humming. In order to extract accuracy features from the user’s humming, we propose a new retrieval method based on multiple pitch candidates. Extracted multiple pitches have shown to be very important parameters in determining melodic similarity, but it is also clear that the confidence measures feature which are obtained from the power are important as well. Furthermore, we propose extending the traditional DP algorithm to three dimensions so that multiple pitch candidates can be treated. Simultaneously, at the melody representation technique, we propose the DP paths are changed dynamically to be able to take relative values so that they can respond to insert or omit notes."
17,Olivier Lartillot,Discovering musical pattern through perceptual heuristics.,2003,https://doi.org/10.5281/zenodo.1417285,"Olivier Lartillot, IRCAM - Centre Pompidou, FRA, facility","""This paper defends the view that the intricate
difficulties challenging the emerging domain of
Musical Pattern Discovery, which is dedicated to the
automation of motivic analysis, will be overcome
only through a thorough taking into account of the
specificity of music as a perceptive object. Actual
musical patterns, although constantly transformed,
are nevertheless perceived by the listener as musical
identities. Such dynamical properties of human
perception, not reducible to geometrical models, will
only be explained with the notions of contexts and
expectations. This paper sketches the general
principles of a new approach that attempts to build
such a general perceptual system. On a sub-cognitive
level, patterns are discovered through the detection,
by an associative memory, of local similarities. On a
cognitive level, patterns are managed by a general
logical framework that avoids irrelevant inferences
and combinatorial explosion. In this way, actual
musical patterns that convey musical significance are
discovered. This approach, offering promising
results, is a first step toward a complete system of
automated music analysis and an explicit modeling of
basic mechanisms for music understanding."""
18,Kjell Lemström;Veli Mäkinen;Anna Pienimäki;M. Turkia;Esko Ukkonen,The C-BRAHMS project.,2003,https://doi.org/10.5281/zenodo.1417551,"Kjell Lemström, University of Helsinki, FIN, education;Veli Mäkinen, University of Helsinki, FIN, education;Anna Pienimäki, University of Helsinki, FIN, education;Mika Turkia, University of Helsinki, FIN, education;Esko Ukkonen, University of Helsinki, FIN, education","""The C-BRAHMS project develops computational methods for content-based retrieval and analysis of music data. A summary of the recent algorithmic and experimental developments of the project is given."""
19,Micheline Lesaffre;Koen Tanghe;Gaëtan Martens;Dirk Moelants;Marc Leman;Bernard De Baets;Hans De Meyer;Jean-Pierre Martens,The MAMI query-by-voice experiment: collecting and annotating vocal queries for music information retrieval.,2003,https://doi.org/10.5281/zenodo.1418133,"Micheline Lesaffre, Ghent University, BEL, education;Koen Tanghe, Ghent University, BEL, education;Gaëtan Martens, Ghent University, BEL, education;Dirk Moelants, Ghent University, BEL, education;Marc Leman, Ghent University, BEL, education;Bernard De Baets, Ghent University, BEL, education;Hans De Meyer, Ghent University, BEL, education;Jean-Pierre Martens, Ghent University, BEL, education","""The MIR research community requires coordinated strategies in dealing with databases for system development and experimentation. Manually annotated files can accelerate the development of accurate analysis tools for music information retrieval. This paper presents background information on an annotated database of vocal queries that is freely available on the Internet. First we outline the design and set up of the experiment through which the vocal queries were generated. Then attention is drawn to the manual annotation of the vocal queries."""
20,Tao Li 0001;Mitsunori Ogihara,Detecting emotion in music.,2003,https://doi.org/10.5281/zenodo.1417293,"Tao Li, University of Rochester, USA, education;Mitsunori Ogihara, University of Rochester, USA, education",""""""
21,Dan Liu 0001;Lie Lu;HongJiang Zhang,Automatic mood detection from acoustic music data.,2003,https://doi.org/10.5281/zenodo.1418335,"Dan Liu, Tsinghua University, CHN, education;Lie Lu, Microsoft Research Asia, CHN, company;Hong-Jiang Zhang, Microsoft Research Asia, CHN, company","Music mood describes the inherent emotional meaning of a music clip.  It is helpful in music understanding, music search and some music-related applications.  In this paper, a hierarchical framework is presented to automate the task of mood detection from acoustic music data, by following some music psychological theories in western cultures.  Three feature sets , intensity, timbre and rhythm, are extracted to represent the characteristics of a music clip.  Moreover, a mood tracking approach is also presented for a whole piece of music.  Experimental evaluations indicate that the proposed algorithms produce satisfactory results."
22,Arie Livshin;Xavier Rodet,The importance of cross database evaluation in musical instrument sound classification: A critical approach.,2003,https://doi.org/10.5281/zenodo.1417771,"Arie Livshin, IRCAM Centre Pompidou, FRA, facility;Xavier Rodet, IRCAM Centre Pompidou, FRA, facility","In numerous articles (Martin and Kim, 1998; Fraser and Fujinaga, 1999; and many others) sound classification algorithms are evaluated using ""self classification"" - the learning and test groups are randomly selected out of the same sound database. We will show that ""self classification"" is not necessarily a good statistic for the ability of a classification algorithm to learn, generalize or classify well. We introduce the alternative ""Minus-1 DB"" evaluation method and demonstrate that it does not have the shortcomings of ""self classification""."
