Unnamed: 0,Authors,Title,Year,Link,Authors with Affiliations,Abstract
23,Ian Knopke;Donald Byrd,Towards Musicdiff: A Foundation for Improved Optical Music Recognition Using Multiple Recognizers.,2007,https://doi.org/10.5281/zenodo.1416522,"Ian Knopke, Indiana University, USA, education;Donald Byrd, Indiana University, USA, education","This paper presents work towards a “musicdiff” program for comparing files representing different versions of the same piece, primarily in the context of comparing versions produced by different optical music recognition (OMR) programs. Previous work by the current authors and others strongly suggests that using multiple recognizers will make it possible to improve OMR accuracy substantially. The basic methodology requires several stages: documents must be scanned and submitted to several OMR programs, programs whose strengths and weaknesses have previously been evaluated in detail. We discuss techniques we have implemented for normalization, alignment and rudimentary error correction. We also describe a visualization tool for comparing multiple versions on a measure-by-measure basis."
24,Olivier Lartillot;Petri Toiviainen,MIR in Matlab (II): A Toolbox for Musical Feature Extraction from Audio.,2007,https://doi.org/10.5281/zenodo.1417145,"Olivier Lartillot, University of Jyväskylä, FIN, education;Petri Toiviainen, University of Jyväskylä, FIN, education","""We present the MIRtoolbox, an integrated set of functions written in Matlab, dedicated to the extraction of musical features from audio ﬁles. The design is based on a mod- ular framework: the different algorithms are decomposed into stages, formalized using a minimal set of elementary mechanisms, and integrating different variants proposed by alternative approaches – including new strategies we have developed –, that users can select and parametrize. This paper offers an overview of the set of features, re- lated, among others, to timbre, tonality, rhythm or form, that can be extracted with the MIRtoolbox. One particular analysis is provided as an example. The toolbox also in- cludes functions for statistical analysis, segmentation and clustering. Particular attention has been paid to the design of a syntax that offers both simplicity of use and transpar- ent adaptiveness to a multiplicity of possible input types. Each feature extraction method can accept as argument an audio ﬁle, or any preliminary result from intermediary stages of the chain of operations. Also the same syntax can be used for analyses of single audio ﬁles, batches of ﬁles, series of audio segments, multi-channel signals, etc. For that purpose, the data and methods of the toolbox are organised in an object-oriented architecture."""
25,Christian Fremerey;Frank Kurth;Meinard Müller;Michael Clausen,A Demonstration of the SyncPlayer System.,2007,https://doi.org/10.5281/zenodo.1415586,"Christian Fremerey, Bonn University, DEU, education;Frank Kurth, Bonn University, DEU, education;Meinard Müller, Bonn University, DEU, education;Michael Clausen, Bonn University, DEU, education","The SyncPlayer system is an advanced audio player for multimodal presentation, browsing, and retrieval of music data. The system has been extended signiﬁcantly in the last few years. In this contribution, we describe the current state of the system and demonstrate the functionalities and interactions of the novel SyncPlayer components including combined inter- and intra-document music browsing."
26,Neil J. Hurley;Félix Balado;Elizabeth P. McCarthy;Guenole C. M. Silvestre,Performance of Philips Audio Fingerprinting under Desynchronisation.,2007,https://doi.org/10.5281/zenodo.1416068,"Neil J. Hurley, University College Dublin, IRL, education;F´elix Balado, University College Dublin, IRL, education;Elizabeth P. McCarthy, University College Dublin, IRL, education;Gu´enol´e C.M. Silvestre, University College Dublin, IRL, education",An audio ﬁngerprint is a compact representation (robust hash) of an audio signal which is linked to its perceptual content. Perceptually equivalent instances of the signal must lead to the same hash value. Fingerprinting ﬁnds application in efﬁcient indexing of music databases. We present a theoretical analysis of the Philips audio ﬁngerprinting method under desynchronisation for correlated stationary Gaussian sources.
27,Mehryar Mohri;Pedro J. Moreno;Eugene Weinstein,"Robust Music Identification, Detection, and Analysis.",2007,https://doi.org/10.5281/zenodo.1418043,"Mehryar Mohri, Courant Institute of Mathematical Sciences, USA, education, Google Inc., USA, company;Pedro Moreno, Google Inc., USA, company;Eugene Weinstein, Courant Institute of Mathematical Sciences, USA, education, Google Inc., USA, company","In previous work, we presented a new approach to music identiﬁcation based on ﬁnite-state transducers and Gaussian mixture models. Here, we expand this work and study the performance of our system in the presence of noise and distortions. We also evaluate a song detection method based on a universal background model in combination with a support vector machine classiﬁer and provide some insight into why our transducer representation allows for accurate identiﬁcation even when only a short song snippet is available."
28,Michaël Betser;Patrice Collen;Jean-Bernard Rault,Audio Identification Using Sinusoidal Modeling and Application to Jingle Detection.,2007,https://doi.org/10.5281/zenodo.1416890,"Michaël Betser, France Télécom R&D, FRA, company;Patrice Collen, France Télécom R&D, FRA, company;Jean-Bernard Rault, France Télécom R&D, FRA, company","""This article presents a new descriptor dedicated to Audio Identification (audioID), based on sinusoidal modeling. The core idea is an appropriate selection of the sinusoidal components of the signal to be detected. This new descriptor is robust against usual distortions found in audioID tasks. It has several advantages compared to classical subband-based descriptors including an increased robustness to additive noise, especially non-random noise such as additional speech, and a robust detection of short audio events.  This descriptor is compared to a classical subband-based feature for a jingle detection task on broadcast radio. It is shown that the new introduced descriptor greatly improves the performance in terms of recall/precision."""
29,Jérôme Lebossé;Luc Brun,Audio Fingerprint Identification by Approximate String Matching.,2007,https://doi.org/10.5281/zenodo.1417927,"Jerome Lebosse, France Telecom R&D, FRA, company;Luc Brun, GREYC UMR 6072, FRA, education",An audio ﬁngerprint is a small digest of an audio ﬁle which allows to identify it among a database of candidates. This paper ﬁrst presents a ﬁngerprint extraction algorithm. The identiﬁcation task is performed by a new identiﬁcation scheme which combines string matching algorithms and q-grams ﬁltration.
30,Yushen Han;Christopher Raphael,Desoloing Monaural Audio Using Mixture Models.,2007,https://doi.org/10.5281/zenodo.1417507,"Yushen Han, Indiana Univ., USA, education;Christopher Raphael, Indiana Univ., USA, education","""We describe a new approach to the “desoloing” problem, in which one tries to isolate the accompanying instruments from a monaural recording of a soloist with accompaniment. Our approach is based on explicit knowledge of the audio in the form of a score match – a correspondence between a symbolic score and the music audio, giving the times of all musical events. We employ the familiar idea of masking the short time Fourier transform to eliminate the solo part. The ideal mask is estimated by fitting a model to the data, whose note-based components are derived from the score match. The parameters for our probabilistic model are estimated using the EM algorithm."""
31,Juan José Burred;Thomas Sikora,Monaural Source Separation from Musical Mixtures Based on Time-Frequency Timbre Models.,2007,https://doi.org/10.5281/zenodo.1416396,"Juan Jos´e Burred, Technical University of Berlin, DEU, education;Thomas Sikora, Technical University of Berlin, DEU, education","We present a system for source separation from monaural musical mixtures based on sinusoidal modeling and on a library of timbre models trained a priori. The models, which rely on Principal Component Analysis, serve as time-frequency probabilistic templates of the spectral envelope. They are used to match groups of sinusoidal tracks and assign them to a source, as well as to reconstruct overlapping partials. The proposed method does not make any assumptions on the harmonicity of the sources, and does not require a previous multipitch estimation stage. Since the timbre matching stage detects the instruments present on the mixture, the system can also be used for classification and segmentation."
32,Alberto Pinto;Reinier H. van Leuken;M. Fatih Demirci;Frans Wiering;Remco C. Veltkamp,Indexing Music Collections Through Graph Spectra.,2007,https://doi.org/10.5281/zenodo.1416744,"Alberto Pinto, Universiteit Utrecht, NLD, education, Università degli Studi di Milano, ITA, education;Reinier H. van Leuken, Universiteit Utrecht, NLD, education;M. Fatih Demirci, Universiteit Utrecht, NLD, education;Frans Wiering, Universiteit Utrecht, NLD, education;Remco C. Veltkamp, Universiteit Utrecht, NLD, education","Content based music retrieval opens up large collections,
both for the general public and music scholars. It basically
enables the user to ﬁnd (groups of) similar melodies, thus
facilitating musicological research of many kinds.
We
present a graph spectral approach, new to the music re-
trieval ﬁeld, in which melodies are represented as graphs,
based on the intervals between the notes they are com-
posed of. These graphs are then indexed into a database
using their laplacian spectra as a feature vector. This lapla-
cian spectrum is known to be very informative about the
graph, and is therefore a good representative of the orig-
inal melody. Consequently, range searching around the
query spectrum returns similar melodies.
We present an experimental evaluation of this approach,
together with a comparison with two known retrieval tech-
niques. On our test corpus, a subset of a well documented
and annotated collection of Dutch folk songs, this eval-
uation demonstrates the effectiveness of the overall ap-
proach."
33,Catherine Lai;Ichiro Fujinaga;David Descheneau;Michael Frishkopf;Jenn Riley;Joseph Hafner;Brian McMillan,Metadata Infrastructure for Sound Recordings.,2007,https://doi.org/10.5281/zenodo.1415224,"Catherine Lai, McGill University, CAN, education;Ichiro Fujinaga, McGill University, CAN, education;David Descheneau, University of Alberta, CAN, education;Michael Frishkopf, University of Alberta, CAN, education;Jenn Riley, Indiana University, USA, education;Joseph Hafner, McGill University, CAN, education;Brian McMillan, McGill University, CAN, education","""This paper describes the first iteration of a working model for searching heterogeneous distributed metadata repositories for sound recording collections, focusing on techniques used for real-time querying and harmonizing diverse metadata models. The initial model for a metadata infrastructure presented here is the first of its kind for sound recordings."""
34,Christian Landone;Joseph Harrop;Josh Reiss,"Enabling Access to Sound Archives Through Integration, Enrichment and Retrieval: The EASAIER Project.",2007,https://doi.org/10.5281/zenodo.1415584,"Christian Landone, Queen Mary, University of London, GBR, education;Joseph Harrop, Royal Scottish Academy of Music and Drama, GBR, education;Josh Reiss, Queen Mary, University of London, GBR, education","""Many  digital  sound  archives  suffer  from  problems 
concerning on-line access: sound materials are often held 
separately from other related media, they are not easily 
browsed and little opportunity to search the actual audio 
content of the material is provided.
The  EASAIER  project  aims  to  alleviate  these 
problems, offering a number of solutions to support sound 
archive  managers  and  users.  EASAIER  will  enable 
enhanced access to sound archives, providing multiple 
methods  of  retrieval,  integration  with  other  media 
archives, content enrichment and enhanced access tools."""
35,Polina Proutskova,Musical Memory of the World - Data Infrastructure in Ethnomusicological Archives.,2007,https://doi.org/10.5281/zenodo.1416316,"Polina Proutskova, Goldsmiths, University of London, Computing department, GBR, education","Ethnomusicological archives build the musical memory of the world, covering the geographical and the historical aspects of music worldwide. This article gives a brief description of the nature and the functionality of ethnomusicological archives. It reflects the current state of data infrastructure (policy and technology), addressing issues of access to archives’ holdings, of online visibility of music collections and of interoperability between archives. An outlook of a mutual involvement and a resulting influence at each others work between MIR community and ethnomusicological archives is given."
36,Rosana S. G. Lanzelotte;Adriana O. Ballesté;Martha Ulhoa,A Digital Collection of Brazilian Lundus.,2007,https://doi.org/10.5281/zenodo.1415634,"Rosana S. G. Lanzelotte, Universidade Federal do Estado do Rio de Janeiro, BRA, education;Adriana O. Ballesté, Laboratório Nacional de Computação Científica, BRA, facility;Martha Ulhoa, Universidade Federal do Estado do Rio de Janeiro, BRA, education","Lundu is a typical Brazilian popular musical form at the 
19th century. The distinguished musicologist Mozart de 
Araújo devoted himself to studying lundus and other 
forms of that period. He collected 48 lundus, which are 
nowadays stored in a private library, unavailable to 
public access. The present work describes the 
implementation of a digital collection of those lundus, 
using Dspace as the repository. Dspace is chosen in 
order to guarantee interoperability through the OAI-
PMH protocol. Metadata is generated using Dublin Core 
elements, fully compatible with Dspace. The digital 
collection provides access to the lundu score images, 
incipits and midi files, as well as metadata. It is the first 
time such a rare collection of 19th Brazilian popular 
music will be available on the web. As Dspace enables 
interoperation among repositories, a broad community 
may access the collection.  "
37,Beinan Li;Simon de Leon;Ichiro Fujinaga,Alternative Digitization Approach for Stereo Phonograph Records Using Optical Audio Reconstruction.,2007,https://doi.org/10.5281/zenodo.1415746,"Beinan Li, Schulich School of Music, McGill University, CAN, education;Simon de Leon, Schulich School of Music, McGill University, CAN, education;Ichiro Fujinaga, Schulich School of Music, McGill University, CAN, education","This paper presents the first Optical Audio Reconstruction (OAR) approach for the long-term digital preservation of stereo phonograph records. OAR uses precision metrology and digital image processing to obtain and convert groove contour data into digital audio for access and preservation. This contactless and imaging-based approach has considerable advantages over the traditional mechanical methods, such as being the only optical method with the potential to restore broken stereo records. Although past efforts on monophonic phonograph records have been successful, no attempts on 33rpm long-playing stereo records (LPs) have been reported."
38,Stefan Leitich;Martin Topf,Globe of Music - Music Library Visualization Using Geosom.,2007,https://doi.org/10.5281/zenodo.1416930,"Stefan Leitich, University of Vienna, AUT, education;Martin Topf, University of Vienna, AUT, education","Music collections are commonly represented as plain textual lists of artist, title, album etc. for each contained music track. The large volume of personal music libraries makes them difﬁcult to browse and access for users. In respect to possible information visualization techniques, no established convenient user interfaces exist. By using a spherical self-organizing map algorithm on low level audio features and processing the resulting map data, a Geographic Information System is used to visualize a music collection. This results in an aspiring music library visualization, which can be handled intuitively by the user and even provides new possibilities for accessing a music collection in the digital domain."
39,Adam R. Tindale;David Sprague;George Tzanetakis,Strike-A-Tune: Fuzzy Music Navigation Using a Drum Interface.,2007,https://doi.org/10.5281/zenodo.1418243,"Adam R. Tindale, University of Victoria, CAN, education;David Sprague, University of Victoria, CAN, education;George Tzanetakis, University of Victoria, CAN, education","A traditional music library system controlled by a mouse
and keyboard is precise, allowing users to select their de-
sired song. Alternatively, randomized playlist or shufﬂes
are used when users have no particular music in mind. We
present a new interface and visualization system called Strike-
A-Tune for fuzzy music navigation.
Fuzzy navigation is
an imprecise navigation approach allowing users to choose
preference related items. We believe this will help users to
play music they want to hear and re-discover infrequently
played songs in their music library, thus combining the best
aspects of precision navigation and shufﬂes. We have de-
signed an interface using an electronic drum to communi-
cate with a visualization and playback system."
40,Paul Lamere;Douglas Eck,Using 3D Visualizations to Explore and Discover Music.,2007,https://doi.org/10.5281/zenodo.1415022,"Paul Lamere, Sun Microsystems, USA, company;Douglas Eck, Sun Microsystems, USA, company","""This paper presents Search Inside the Music an application for exploring and discovering new music. Search Inside the Music uses a music similarity model and 3D visual- izations to provide a user with new tools for exploring and interacting with a music collection. With Search Inside the Music, a music listener can ﬁnd new music, generate interesting playlists, and interact with their music collec- tion."""
41,Stephen Hitchner;Jennifer Murdoch;George Tzanetakis,Music Browsing Using a Tabletop Display.,2007,https://doi.org/10.5281/zenodo.1415896,"Stephen Hitchner, Univeristy of Victoria, CAN, education;Jennifer Murdoch, University of Victoria, CAN, education;George Tzanetakis, University of Victoria, CAN, education","The majority of work in Music Information Retrieval (MIR) follows a search/retrieval paradigm. More recently, the importance of browsing as an interaction paradigm has been realized, and several novel interfaces have been proposed. In this paper, we describe two novel interaction schemes for content-aware browsing of music collections that use a graphical tabletop interface. We further present findings from qualitative user studies. We describe our work in the context of two primary themes: music collection browsing, and collaborative (multiple simultaneous users) interaction and involvement during the browsing/selection process."
42,Peter Knees,Search & Select - Intuitively Retrieving Music from Large Collections.,2007,https://doi.org/10.5281/zenodo.1416456,"Peter Knees, Johannes Kepler University Linz, AUT, education","A retrieval system for large-scale collections that allows users to search for music using natural language queries and relevance feedback is presented. In contrast to existing music search engines that are either restricted to manually annotated meta-data or based on a query-by-example variant, the presented approach describes audio pieces via a traditional term vector model and allows therefore to retrieve relevant music pieces by issuing simple free-form text queries. Term vector descriptors for music pieces are derived by applying Web-based and audio-based similarity measures. Additionally, as the user selects music pieces that he/she likes, the subsequent results are adapted to accommodate to the user’s preferences. Real-world performance of the system is indicated by a small user study."
43,Marco Tiemann;Steffen Pauws;Fabio Vignoli,Ensemble Learning for Hybrid Music Recommendation.,2007,https://doi.org/10.5281/zenodo.1417781,"Marco Tiemann, Philips Research Europe, NLD, facility;Steffen Pauws, Philips Research Europe, NLD, facility;Fabio Vignoli, Philips Research Europe, NLD, facility","We investigate ensemble learning methods for hybrid music recommenders, combining a social and a content-based recommender algorithm in an initial experiment by applying a simple combination rule to merge recommender results. A first experiment suggests that such a combination can reduce the mean absolute prediction error compared to the used recommenders’ individual errors."
44,Justin Donaldson;Ian Knopke,Music Recommendation Mapping and Interface Based on Structural Network Entropy.,2007,https://doi.org/10.5281/zenodo.1417329,"Justin Donaldson, Indiana University School of Informatics, USA, education;Ian Knopke, Indiana University School of Informatics, USA, education","Recommendation systems generally produce the results of their output to their users in the form of an ordinal list. In the interest of simplicity, these lists are often obscure, abstract, or omit many relevant metrics pertaining to the measured strength of the recommendations or the relationships the recommended items share with each other. This information is often useful for coming to a better understanding of the nature of how the items are structured according to the recommendation data. This paper describes the ZMDS algorithm, a novel way of analyzing the fundamental network structure of recommendation results. Furthermore, it also describes a dynamic plot interaction method as a recommendation browsing utility. A novel “Recommendation Map” web application implements both the ZMDS algorithm and the plot interface and are offered as an example of both components working together."
45,Teemu Tuomas Ahmaniemi,Influence of Tempo and Subjective Rating of Music in Step Frequency of Running.,2007,https://doi.org/10.5281/zenodo.1418107,", ",""""""
46,Daniel McEnnis;Sally Jo Cunningham,Sociology and Music Recommendation Systems.,2007,https://doi.org/10.5281/zenodo.1414854,"Daniel McEnnis, Waikato University, NZL, education;Sally Jo Cunningham, Waikato University, NZL, education","Music recommendation systems have centred on two
different approaches: content based analysis and collabo-
rative ﬁltering. Little attention has been paid to the rea-
sons why these techniques have been effective.
Fortu-
nately, the social sciences have asked these questions. One
of the ﬁndings of this research is that social context is
much more important than previously thought. This pa-
per introduces this body of research from sociology and
its relevance to music recommendation algorithms."
47,Arpi Mardirossian;Elaine Chew,Visualizing Music: Tonal Progressions and Distributions.,2007,https://doi.org/10.5281/zenodo.1417773,"Arpi Mardirossian, University of Southern California Viterbi School of Engineering, USA, education;Elaine Chew, University of Southern California Viterbi School of Engineering, USA, education","""This paper presents a music visualization tool that shows the tonal progression in, and tonal distribution of, a piece of music on Lerdahl’s two-dimensional tonal pitch space. The method segments a piece into uniform time slices, and determines the most likely key in each slice. It then generates the visualization by dynamically showing the sequence of keys as translucent, growing discs on the two-dimensional plane. The frequency of a key is indicated by the size of its colored disc. Each color and position corresponds to a key, and related keys are shown in proximity with related colors. The visual result effectively presents the changing distribution of the keys employed. The proposed visualization is an improvement over more basic charting methods, such as histograms, and it maintains standards of information design in the form of added dimensionality, color, and animation. We show that the visualization is invariant under music transformations that preserve the piece’s identity. We conclude by illustrating how this method may be used to visually distinguish between tonal progression and distribution patterns in western classical versus Armenian folk music."""
48,Özgür Izmirli,Localized Key Finding from Audio Using Nonnegative Matrix Factorization for Segmentation.,2007,https://doi.org/10.5281/zenodo.1417197,"Özgür İzmirli, Connecticut College, USA, education","A model for localized key finding from audio is proposed. Besides being able to estimate the key in which a piece starts, the model can also identify points of modulation and label multiple sections with their key names throughout a single piece. The front-end employs an adaptive tuning stage prior to spectral analysis and calculation of chroma features. The segmentation stage uses groups of contiguous chroma vectors as input and identifies sections that are candidates for unique local keys in relation to their neighboring key centers. Non-negative matrix factorization with additional sparsity constraints and additive updates is used for segmentation. The use of segmentation is demonstrated for single and multiple key estimation problems. A correlational model of key finding is applied to the candidate segments to estimate the local keys. Evaluation is given on three different data sets and a range of analysis parameters."
