Unnamed: 0,Authors,Title,Year,Link,Authors with Affiliations,Abstract
96,Annamaria Mesaros;Tuomas Virtanen;Anssi Klapuri,Singer Identification in Polyphonic Music Using Vocal Separation and Pattern Recognition Methods.,2007,https://doi.org/10.5281/zenodo.1417395,"Annamaria Mesaros, Tampere University of Technology, Institute of Signal Processing, FIN, education;Tuomas Virtanen, Tampere University of Technology, Institute of Signal Processing, FIN, education;Anssi Klapuri, Tampere University of Technology, Institute of Signal Processing, FIN, education","This paper evaluates methods for singer identiﬁcation in polyphonic music, based on pattern classiﬁcation together with an algorithm for vocal separation. Classiﬁcation strategies include the discriminant functions, Gaussian mixture model (GMM)-based maximum likelihood classiﬁer and nearest neighbour classiﬁers using Kullback-Leibler divergence between the GMMs. A novel method of estimating the symmetric Kullback-Leibler distance between two GMMs is proposed. Two different approaches to singer identiﬁcation were studied: one where the acoustic features were extracted directly from the polyphonic signal and one where the vocal line was ﬁrst separated from the mixture using a predominant melody transcription system. The methods are evaluated using a database of songs where the level difference between the singing and the accompaniment varies. It was found that vocal line separation enables robust singer identiﬁcation down to 0dB and -5dB singer-to-accompaniment ratios."
97,Stanislaw Andrzej Raczynski;Nobutaka Ono;Shigeki Sagayama,Multipitch Analysis with Harmonic Nonnegative Matrix Approximation.,2007,https://doi.org/10.5281/zenodo.1417809,"Stanisław A. Raczyński, The University of Tokyo, JPN, education;Nobutaka Ono, The University of Tokyo, JPN, education;Shigeki Sagayama, The University of Tokyo, JPN, education","""This paper presents a new approach to multipitch analysis by utilizing the Harmonic Nonnegative Matrix Approximation, a harmonically-constrained and penalized version of the Nonnegative Matrix Approximation (NNMA) method. It also includes a description of a note onset, offset and amplitude retrieval procedure based on that technique. Compared with the previous NNMA approaches, specific initialization of the basis matrix is employed – the basis matrix is initialized with zeros everywhere but at positions corresponding to harmonic frequencies of consequent notes of the equal temperament scale. This results in the basis containing nothing but harmonically structured vectors, even after the learning process, and the activity matrix’s rows containing peaks corresponding to note onset times and amplitudes. Furthermore, additional penalties of mutual uncorrelation and sparseness of rows are placed upon the activity matrix. The proposed method is able to uncover the underlying musical structure better than the previous NNMA approaches and makes the note detection process very straightforward."""
98,Eric Nichols;Christopher Raphael,Automatic Transcription of Music Audio Through Continuous Parameter Tracking.,2007,https://doi.org/10.5281/zenodo.1416162,"Eric Nichols, Indiana Univ., USA, education;Christopher Raphael, Indiana Univ., USA, education","We present a method for transcribing arbitrary pitched music into a piano-roll-like representation that also tracks the amplitudes of the notes over time. We develop a probabilistic model that gives the likelihood of a frame of audio data given a vector of amplitudes for the possible notes. Using an approximation of the log likelihood function, we develop an objective function that is quadratic in the time-varying amplitude variables, while also depending on the discrete piano-roll variables. We optimize this function using a variant of dynamic programming, by repeatedly growing and pruning our histories. We present results on a variety of different examples using several measures of performance including an edit-distance measure as well as a frame-by-frame measure."
99,Chunghsin Yeh;Niels Bogaards;Axel Röbel,Synthesized Polyphonic Music Database with Verifiable Ground Truth for Multiple F0 Estimation.,2007,https://doi.org/10.5281/zenodo.1415732,"Chunghsin Yeh, IRCAM / CNRS-STMS, FRA, facility;Niels Bogaards, IRCAM, FRA, facility;Axel Roebel, IRCAM / CNRS-STMS, FRA, facility","To study and to evaluate a multiple F0 estimation algorithm, a polyphonic database with verifiable ground truth is necessary. Real recordings with manual annotation as ground truth are often used for evaluation. However, ambiguities arise during manual annotation, which are often set up by subjective judgements. Therefore, in order to have access to verifiable ground truth, we propose a systematic method for creating a polyphonic music database. Multiple monophonic tracks are rendered from a given MIDI file, in which rendered samples are separated to prevent overlaps and to facilitate automatic annotation. F0s can then be reliably extracted as ground truth, which are stored using SDIF."
100,Jayme Garcia Arnal Barbedo;Amauri Lopes;Patrick J. Wolfe,High Time-Resolution Estimation of Multiple Fundamental Frequencies.,2007,https://doi.org/10.5281/zenodo.1415972,"Jayme Garcia Arnal Barbedo, Harvard University, USA, education; State University of Campinas, BRA, education;Amauri Lopes, State University of Campinas, BRA, education;Patrick J. Wolfe, Harvard University, USA, education","This paper presents a high time-resolution strategy to estimate multiple fundamental frequencies in musical signals. The signal is first divided into overlapping blocks, and a high-resolution estimate made of the short-term spectrum. The resulting spectrum is modified such that only the most relevant spectral components are considered, and an iterative algorithm based on earlier work by Klapuri is used to identify candidate fundamental frequencies. Finally, a context-based rule is used to improve the accuracy of fundamental frequency estimates. The performance of this technique is investigated under both noiseless and noisy conditions, and its accuracy is examined in cases where the polyphony is known and unknown a priori."
101,David A. Torres;Douglas Turnbull;Luke Barrington;Gert R. G. Lanckriet,Identifying Words that are Musically Meaningful.,2007,https://doi.org/10.5281/zenodo.1417175,"David Torres, University of California, San Diego, USA, education;Douglas Turnbull, University of California, San Diego, USA, education;Luke Barrington, University of California, San Diego, USA, education;Gert Lanckriet, University of California, San Diego, USA, education","A musically meaningful vocabulary is one of the keystones
in building a computer audition system that can model the
semantics of audio content. If a word in the vocabulary is
inconsistently used by human annotators, or the word is
not clearly represented by the underlying acoustic repre-
sentation, the word can be considered as noisy and should
be removed from the vocabulary to denoise the model-
ing process.
This paper proposes an approach to con-
struct a vocabulary of predictive semantic concepts based
on sparse canonical component analysis (sparse CCA) .
Experimental results illustrate that, by identifying musi-
cally meaningful words, we can improve the performance
of a previously proposed computer audition system for
music annotation and retrieval."
102,Mark Levy;Mark B. Sandler,A Semantic Space for Music Derived from Social Tags.,2007,https://doi.org/10.5281/zenodo.1415628,"Mark Levy, Centre for Digital Music, Queen Mary, University of London, GBR, education;Mark Sandler, Centre for Digital Music, Queen Mary, University of London, GBR, education","""In this paper we investigate social tags as a novel high-volume source of semantic metadata for music, using techniques from the ﬁelds of information retrieval and multivariate data analysis. We show that, despite the ad hoc and informal language of tagging, tags deﬁne a low-dimensional semantic space that is extremely well-behaved at the track level, in particular being highly organised by artist and musical genre. We introduce the use of Correspondence Analysis to visualise this semantic space, and show how it can be applied to create a browse-by-mood interface for a psychologically-motivatedtwo-dimensional subspace representing musical emotion."""
103,Yves Raimond;Samer A. Abdallah;Mark B. Sandler;Frederick Giasson,The Music Ontology.,2007,https://doi.org/10.5281/zenodo.1415966,"Yves Raimond, Queen Mary, University of London, GBR, education;Samer Abdallah, Queen Mary, University of London, GBR, education;Mark Sandler, Queen Mary, University of London, GBR, education;Frederick Giasson, Zitgist LLC, USA, company","""In this paper, we overview some Semantic Web technolo-
gies and describe the Music Ontology: a formal frame-
work for dealing with music-related information on the
Semantic Web, including editorial, cultural and acous-
tic information. We detail how this ontology can act as a
grounding for more domain-speciﬁc knowledge represen-
tation. In addition, we describe current projects involving
the Music Ontology and interlinked repositories of music-
related knowledge."""
104,Jean-Julien Aucouturier;François Pachet;Pierre Roy;Anthony Beurivé,Signal + Context = Better Classification.,2007,https://doi.org/10.5281/zenodo.1416852,"Jean-Julien Aucouturier, The University of Tokyo, JPN, education;Franc¸ois Pachet, SONY CSL Paris, FRA, company;Pierre Roy, SONY CSL Paris, FRA, company;Anthony Beuriv´e, SONY CSL Paris, FRA, company","Typical signal-based approaches to extract musical descriptions from audio only have limited precision. A possible explanation is that they do not exploit context, which provides important cues in human cognitive processing of music: e.g. electric guitar is unlikely in 1930s music, children choirs rarely perform heavy metal, etc. We propose an architecture to train a large set of binary classifiers simultaneously, for many different musical metadata (genre, instrument, mood, etc.), in such a way that correlation between metadata is used to reinforce each individual classifier. The system is iterative: it uses classification decisions it made on some classification problems as new features for new, harder problems; and hybrid: it uses a signal classifier based on timbre similarity to bootstrap symbolic inference with decision trees. While further work is needed, the approach seems to outperform signal-only algorithms by 5% precision on average, and sometimes up to 15% for traditionally difficult problems such as cultural and subjective categories."
105,Parag Chordia;Alex Rae,Raag Recognition Using Pitch-Class and Pitch-Class Dyad Distributions.,2007,https://doi.org/10.5281/zenodo.1416888,"Parag Chordia, Georgia Institute of Technology, USA, education;Alex Rae, Georgia Institute of Technology, USA, education","""We describe the results of the ﬁrst large-scale raag recog-
nition experiment. Raags are the central structure of In-
dian classical music, each consisting of a unique set of
complex melodic gestures. We construct a system to rec-
ognize raags based on pitch-class distributions (PCDs)
and pitch-class dyad distributions (PCDDs) calculated di-
rectly from the audio signal. A large, diverse database
consisting of 20 hours of recorded performances in 31 dif-
ferent raags by 19 different performers was assembled to
train and test the system. Classiﬁcation was performed us-
ing support vector machines, maximum a posteriori (MAP)
rule using a multivariate likelihood model (MVN), and
Random Forests. When classiﬁcation was done on 60s
segments, a maximum classiﬁcation accuracy of 99.0%
was attained in a cross-validation experiment. In a more
difﬁcult unseen generalization experiment, accuracy was
75%. The current work clearly demonstrates the effective-
ness of PCDs and PCDDs in discriminating raags, even
when musical differences are subtle."""
106,Pedro J. Ponce de León;David Rizo;José Manuel Iñesta Quereda,Towards a Human-Friendly Melody Characterization by Automatically Induced Rules.,2007,https://doi.org/10.5281/zenodo.1414902,"Pedro J. Ponce de León, Universidad de Alicante, Spain, education;David Rizo, Universidad de Alicante, Spain, education;José M. Iñesta, Universidad de Alicante, Spain, education","There is an increasing interest in music information retrieval for reference, motive, or thumbnail extraction from a piece in order to have a compact and representative representation of the information to be retrieved. One of the main references for music is its melody. In a practical environment of symbolic format collections the information can be found in standard MIDI file format, structured as a number of tracks, usually one of them containing the melodic line, while the others contain the accompaniment. The goal of this work is to analyse how statistical rules can be used to characterize a melody in such a way that one can understand the solution of an automatic system for selecting the track containing the melody in such files."
107,George Tzanetakis;Randy Jones;Kirk McNally,Stereo Panning Features for Classifying Recording Production Style.,2007,https://doi.org/10.5281/zenodo.1417537,"George Tzanetakis, University of Victoria, CAN, education;Randy Jones, University of Victoria, CAN, education;Kirk McNally, University of Victoria, CAN, education","Recording engineers, mixers and producers play important yet often overlooked roles in defining the sound of a particular record, artist or group. The placement of different sound sources in space using stereo panning information is an important component of the production process. Audio classification systems typically convert stereo signals to mono and to the best of our knowledge have not utilized information related to stereo panning. In this paper we propose a set of audio features that can be used to capture stereo information. These features are shown to provide statistically important information for non-trivial audio classification tasks and are compared with the traditional Mel-Frequency Cepstral Coefficients. The proposed features can be viewed as a first attempt to capture extra-musical information related to the production process through music information retrieval techniques."
108,Ioannis Karydis;Alexandros Nanopoulos;Apostolos N. Papadopoulos;Emilios Cambouropoulos,VISA: The Voice Integration/Segregation Algorithm.,2007,https://doi.org/10.5281/zenodo.1416552,"Ioannis Karydis, Aristotle University of Thessaloniki, GRC, education;Alexandros Nanopoulos, Aristotle University of Thessaloniki, GRC, education;Apostolos N. Papadopoulos, Aristotle University of Thessaloniki, GRC, education;Emilios Cambouropoulos, Aristotle University of Thessaloniki, GRC, education","Listeners are capable to perceive multiple voices in music. Adopting a perceptual view of musical ‘voice’ that corresponds to the notion of auditory stream, a computational model is developed that splits musical scores (symbolic musical data) into different voices. A single ‘voice’ may consist of more than one synchronous notes that are perceived as belonging to the same auditory stream; in this sense, the proposed algorithm, may separate a given musical work into fewer voices than the maximum number of notes in the greatest chord. This is paramount, among other, for developing MIR systems that enable pattern recognition and extraction within musically pertinent ‘voices’ (e.g. melodic lines). The algorithm is tested against a small dataset that acts as groundtruth."
109,Jörg Garbers;Peter van Kranenburg;Anja Volk;Frans Wiering;Remco C. Veltkamp;Louis P. Grijp,Using Pitch Stability Among a Group of Aligned Query Melodies to Retrieve Unidentified Variant Melodies.,2007,https://doi.org/10.5281/zenodo.1418191,"Jörg Garbers, Utrecht University, NLD, education;Peter van Kranenburg, Utrecht University, NLD, education;Anja Volk, Utrecht University, NLD, education;Frans Wiering, Utrecht University, NLD, education;Remco C. Veltkamp, Utrecht University, NLD, education;Louis P. Grijp, Meertens Institute, Amsterdam, NLD, facility","Melody identiﬁcation is an important task in folk song variation research. In this paper we develop methods and tools that support researchers in ﬁnding melodies in a database that belong to the same variant group as a set of given melodies. The basic approach is to derive from the pitches of the known variants per onset a weighted pitch distribution, which quantiﬁes pitch stability. We allow for partial matching and AND and OR queries. Technically we do so by deﬁning a distance measure between weighted pitch distribution sequences. It is based on two applications of the Earth Mover’s Distance, which is a distribution distance. We set up a distance framework and discuss musically meaningful parameterizations for two tasks: a) Study the inner-group distances between the group as a whole and single members of the group. b) Use the group’s weighted pitch distribution sequence to query for variant melodies. The ﬁrst experimental results seem very promising: a) The inner-group distances correlate to expert assigned subgroups. b) For variant retrieval our method works better than last year’s MIREX winner."
110,Christian André Romming;Eleanor Selfridge-Field,Algorithms for Polyphonic Music Retrieval: The Hausdorff Metric and Geometric Hashing.,2007,https://doi.org/10.5281/zenodo.1417615,"Christian André Romming, Stanford University, USA, education;Eleanor Selfridge-Field, Stanford University, USA, education","We consider two formulations of the computational problem of transposition-invariant, time-offset tolerant, meter-invariant, and time-scale invariant polyphonic music retrieval. We provide algorithms for both that are scalable in the sense that space requirements are asymptotically linear and queries are efficient for large databases of music. The focus is on cases where a query pattern M consisting of m events is to be matched against a database N consisting of n events, and m ≪ n. The database is assumed to be polyphonic, and the algorithms support polyphonic queries. We are interested in finding exact and proximate occurrences of the query pattern. The first problem considered is that of finding the minimum directed Hausdorff distance from M to N. We give a (2 + ǫ)-approximation algorithm that solves this problem in O (nm) query time and O (n) space. The second problem is that of finding all maximal subset matches of M in N, and we give an algorithm that solves this problem in O  m3 (k + 1)  query time and O  w2n  space, where w represents the maximum window size and k is the number of matches. Using the same method, the problem can be solved in O (m (k + 1)) query time and O (wn) space if we do not require the time-scale invariance property. The latter query time is asymptotically optimal for the given problem."
111,Keiichiro Hoashi;Hiromi Ishizaki;Kazunori Matsumoto;Fumiaki Sugaya,Content-Based Music Retrieval Using Query Integration for Users with Diverse Preferences.,2007,https://doi.org/10.5281/zenodo.1416004,"Keiichiro Hoashi, KDDI R&D Laboratories, Inc., JPN, company;Hiromi Ishizaki, KDDI R&D Laboratories, Inc., JPN, company;Kazunori Matsumoto, KDDI R&D Laboratories, Inc., JPN, company;Fumiaki Sugaya, KDDI R&D Laboratories, Inc., JPN, company","This paper proposes content-based music information retrieval (MIR) methods based on user preferences, which aim to improve the accuracy of MIR for users with “diverse” preferences, i.e., users whose preferences range in songs with a wide variety of features. The proposed MIR method dynamically generates an optimal set of query vectors from the sample set of songs submitted by the user to express their preferences, based on the similarity of the songs in the sample set. Experiments conducted on a music collection with subjective user ratings verify that our proposal is effective to improve the accuracy of content-based MIR. Furthermore, by implementing a two-step MIR algorithm which utilizes song clustering results, the efficiency of the proposed MIR method is significantly improved."
112,Hiromasa Fujihara;Masataka Goto,A Music Information Retrieval System Based on Singing Voice Timbre.,2007,https://doi.org/10.5281/zenodo.1416228,"Hiromasa Fujihara, National Institute of Advanced Industrial Science and Technology (AIST), JPN, facility;Masataka Goto, National Institute of Advanced Industrial Science and Technology (AIST), JPN, facility","We developed a music information retrieval system based on singing voice timbre, i.e., a system that can search for songs in a database that have similar vocal timbres. To achieve this, we developed a method for extracting feature vectors that represent characteristics of singing voices and calculating the vocal-timbre similarity between two songs by using a mutual information content of their feature vectors. We operated the system using 75 songs and confirmed that the system worked appropriately. According to the results of a subjective experiment, 80% of subjects judged that compared with a conventional method using MFCC, our method finds more appropriate songs that have similar vocal timbres."
113,Hamish Allan;Daniel Müllensiefen;Geraint A. Wiggins,Methodological Considerations in Studies of Musical Similarity.,2007,https://doi.org/10.5281/zenodo.1416956,"Hamish Allan, Goldsmiths, University of London, GBR, education;Daniel M¨ullensiefen, Goldsmiths, University of London, GBR, education;Geraint Wiggins, Goldsmiths, University of London, GBR, education","There are many different aspects of musical similarity [7]. Some relate to acoustic properties, such as melodic [5], rhythmic [10], harmonic [9] and timbral [2]. Others are bound up in cultural aspects: artists involved in creation, year of ﬁrst release, subject matter of lyrics, demograph- ics of listeners, etc. In judgments about musical similar- ity, the relative importance of each of these aspects will change, not only for different listeners, but also for the same listener in different contexts [11]. Extra care must therefore be taken when designing studies in musical sim- ilarity to ensure that the context is an explicit variable. This paper describes the methodology behind our work in context-based musical similarity; introduces a novel sys- tem through which users can specify by example the con- text and focus of their retrieval needs; and details the de- sign of a study to ﬁnd parameters for our system which can also be adapted to test the system as a whole."
114,Malcolm Slaney;William White,Similarity Based on Rating Data.,2007,https://doi.org/10.5281/zenodo.1416402,"Malcolm Slaney, Yahoo! Research, USA, company;William White, Yahoo! Media Innovation, USA, company","""This paper describes an algorithm to measure the similar-
ity of two multimedia objects, such as songs or movies,
using users’ preferences. Much of the previous work on
query-by-example (QBE) or music similarity uses detailed
analysis of the object’s content. This is difﬁcult and it is
often impossible to capture how consumers react to the
music. We argue that a large collection of user’s pref-
erences is more accurate, at least in comparison to our
benchmark system, at ﬁnding similar songs. We describe
an algorithm based the song’s rating data, and show how
this approach works by measuring its performance using
an objective metric based on whether the same artist per-
formed both songs. Our similarity results are based on 1.5
million musical judgments by 380,000 users. We test our
system by generating playlists using a content-based sys-
tem, our rating-based system, and a random list of songs.
Music listeners greatly preferred the ratings-based playlists
over the content-based and random playlists."""
115,Jeremy Reed;Chin-Hui Lee,A Study on Attribute-Based Taxonomy for Music Information Retrieval.,2007,https://doi.org/10.5281/zenodo.1414910,"Jeremy Reed, Georgia Institute of Technology, USA, education;Chin-Hui Lee, Georgia Institute of Technology, USA, education","""We propose an attribute-based taxonomy approach to providing alternative labels to music.  Labels, such as genre, are often used as ground-truth for describing song similarity in music information retrieval (MIR) systems.  A consistent labelling scheme is usually a key in determining quality of classifier learning in training and performance in testing of an MIR system.  We examine links between conventional genre-based taxonomies and acoustical attributes available in text-based descriptions of songs. We show that the vector representation of each song based on these acoustic attributes enables a framework for unsupervised clustering of songs to produce alternative labels and quantitative measures of similarity between songs. Our experimental results demonstrate that this new set of labels are meaningful and classifiers based on these labels achieve similar or better results than those designed with existing genre-based labels."""
