Unnamed: 0,Authors,Title,Year,Link,Authors with Affiliations,Abstract
81,Peter Foster;Anssi Klapuri;Mark D. Plumbley,Causal Prediction of Continuous-Valued Music Features.,2011,https://doi.org/10.5281/zenodo.1418337,Peter Foster+Queen Mary University of London>GBR>education;Anssi Klapuri+Queen Mary University of London>GBR>education;Mark D. Plumbley+Queen Mary University of London>GBR>education,"""This paper investigates techniques for predicting sequences of continuous-valued feature vectors extracted from musical audio. In particular, we consider prediction of beat-synchronous Mel-frequency cepstral coefficients and chroma features in a causal setting, where features are predicted as they unfold in time. The methods studied comprise autoregressive models, N-gram models incorporating a smoothing scheme, and a novel technique based on repetition detection using a self-distance matrix. Furthermore, we propose a method for combining predictors, which relies on a running estimate of the error variance of the predictors to inform a linear weighting of the predictor outputs. Results indicate that incorporating information on long-term structure improves the prediction performance for continuous-valued, sequential musical data. For the Beatles data set, combining the proposed self-distance based predictor with both N-gram and autoregressive methods results in an average of 13% improvement compared to a linear predictive baseline."""
82,Benjamin Martin 0001;Pierre Hanna;Ta Vinh Thong;Myriam Desainte-Catherine;Pascal Ferraro,Exemplar-based Assignment of Large Missing Audio Parts using String Matching on Tonal Features.,2011,https://doi.org/10.5281/zenodo.1417977,"Benjamin Martin+LaBRI, Université de Bordeaux>FRA>education;Pierre Hanna+LaBRI, Université de Bordeaux>FRA>education;Vinh-Thong Ta+LaBRI, Université de Bordeaux>FRA>education;Pascal Ferraro+LaBRI, Université de Bordeaux>FRA>education;Myriam Desainte-Catherine+LaBRI, Université de Bordeaux>FRA>education","We propose a new approach for assigning audio data in large missing audio parts (from 1 to 16 seconds). Inspired by image inpainting approaches, the proposed method uses the repetitive aspect of music pieces on musical features to recover missing segments via an exemplar-based reconstruction. Tonal features combined with a string matching technique allows locating repeated segments accurately. The evaluation consists in performing on both musician and non-musician subjects listening tests of randomly reconstructed audio excerpts, and experiments highlight good results in assigning musically relevant parts. The contribution of this paper is twofold: bringing musical features to solve a signal processing problem in the case of large missing audio parts, and successfully applying exemplar-based techniques on musical signals while keeping a musical consistency on audio pieces."
83,Zhiyao Duan;Bryan Pardo,Aligning Semi-Improvised Music Audio with Its Lead Sheet.,2011,https://doi.org/10.5281/zenodo.1417325,Zhiyao Duan+Northwestern University>USA>education;Bryan Pardo+Northwestern University>USA>education,"Existing audio-score alignment methods assume that the audio performance is faithful to a fully-notated MIDI score. For semi-improvised music (e.g. jazz), this assumption is strongly violated. In this paper, we address the problem of aligning semi-improvised music audio with a lead sheet. Our approach does not require prior training on performances of the lead sheet to be aligned. We start by analyzing the problem and propose to represent the lead sheet as a MIDI file together with a structural information file. Then we propose a dynamic-programming-based system to align the chromagram representations of the audio performance and the MIDI score. Techniques are proposed to address the chromagram scaling, key transposition and structural change (e.g. a performer unexpectedly repeats a section) problems. We test our system on 3 jazz lead sheets. For each sheet we align a set of solo piano performances and a set of full-band commercial recordings with different instrumentation and styles. Results show that our system achieves promising results on some highly improvised music."
84,Cynthia C. S. Liem;Alan Hanjalic,Expressive Timing from Cross-Performance and Audio-based Alignment Patterns: An Extended Case Study.,2011,https://doi.org/10.5281/zenodo.1416992,Cynthia C.S. Liem+Delft University of Technology>NLD>education;Alan Hanjalic+Delft University of Technology>NLD>education,"Audio recordings of classical music pieces reflect the artistic interpretation of the piece as seen by the recorded performing musician. With many recordings being typically available for the same music piece, multiple expressive rendition variations of this piece are obtained, many of which are induced by the underlying musical content. In earlier work, we focused on timing as a means of expressivity, and proposed a light-weight, unsupervised and audio-based method to study timing deviations among different performances through alignment patterns. By using the standard deviation of alignment patterns as a measure for the display of individuality in a recording, structural and interpretational aspects of a music piece turned out to be highlighted in a qualitative case study on five Chopin mazurkas. In this paper, we propose an entropy-based deviation measure as an alternative to the existing standard deviation measure. The obtained results for multiple short-time window resolutions, both from a quantitative and qualitative perspective, strengthen our earlier finding that the found patterns are musically informative and confirm that entropy is a good alternative measure for highlighting expressive timing deviations in recordings."
85,Takuma Otsuka;Kazuhiro Nakadai;Tetsuya Ogata;Hiroshi G. Okuno,Incremental Bayesian Audio-to-Score Alignment with Flexible Harmonic Structure Models.,2011,https://doi.org/10.5281/zenodo.1418159,"Takuma Otsuka+Kyoto University>JPN>education;Kazuhiro Nakadai+Honda Research Institute Japan, Co., Ltd.>JPN>company;Tetsuya Ogata+Kyoto University>JPN>education;Hiroshi G. Okuno+Kyoto University>JPN>education","Music information retrieval, especially the audio-to-score alignment problem, often involves a matching problem between the audio and symbolic representations. We must cope with uncertainty in the audio signal generated from the score in a symbolic representation such as the variation in the timbre or temporal fluctuations. Existing audio-to-score alignment methods are sometimes vulnerable to the uncertainty in which multiple notes are simultaneously played with a variety of timbres because these methods rely on static observation models. For example, a chroma vector or a fixed harmonic structure template is used under the assumption that musical notes in a chord are all in the same volume and timbre. This paper presents a particle filter-based audio-to-score alignment method with a flexible observation model based on latent harmonic allocation. Our method adapts to the harmonic structure for the audio-to-score matching based on the observation of the audio signal through Bayesian inference. Experimental results with 20 polyphonic songs reveal that our method is effective when more number of instruments are involved in the ensemble."
86,Kenta Okumura;Shinji Sako;Tadashi Kitamura,Stochastic Modeling of a Musical Performance with Expressive Representations from the Musical Score.,2011,https://doi.org/10.5281/zenodo.1417093,Kenta Okumura+Nagoya Institute of Technology>JPN>education;Shinji Sako+Nagoya Institute of Technology>JPN>education;Tadashi Kitamura+Nagoya Institute of Technology>JPN>education,"This paper presents a method for describing the characteristics of human musical performance. We consider the problem of building models that express the ways in which deviations from a strict interpretations of the score occurs in the performance, and that cluster these deviations automatically. The clustering process is performed using expressive representations unambiguously notated on the musical score, without any arbitrariness by the human observer. The result of clustering is obtained as hierarchical tree structures for each deviational factor that occurred during the operation of the instrument. This structure represents an approximation of the performer’s interpretation with information notated on the score they used during the performance. This model represents the conditions that generate the difference in the fluctuation of performance expression and the amounts of deviational factors directly from the data of real performance. Through validations of applying the method to the data measured from real performances, we show that the use of information regarding expressive representation on the musical score enables the efficient estimation of generative-model for the musical performance."
87,Brian McFee;Gert R. G. Lanckriet,The Natural Language of Playlists.,2011,https://doi.org/10.5281/zenodo.1418119,"Brian McFee+University of California, San Diego>USA>education|University of California, San Diego>USA>education;Gert Lanckriet+University of California, San Diego>USA>education|University of California, San Diego>USA>education","We propose a simple, scalable, and objective evaluation procedure for playlist generation algorithms. Drawing on standard techniques for statistical natural language processing, we characterize playlist algorithms as generative models of strings of songs belonging to some unknown language. To demonstrate the procedure, we compare several playlist algorithms derived from content, semantics, and meta-data. We then develop an efficient algorithm to learn an optimal combination of simple playlist algorithms. Experiments on a large collection of naturally occurring playlists demonstrate the efficacy of the evaluation procedure and learning algorithm."
88,Bernhard Niedermayer;Sebastian Böck;Gerhard Widmer,"On the Importance of ""Real"" Audio Data for MIR Algorithm Evaluation at the Note-Level - A Comparative Study.",2011,https://doi.org/10.5281/zenodo.1417923,Bernhard Niedermayer+Johannes Kepler University Linz>AUT>education;Sebastian Böck+Johannes Kepler University Linz>AUT>education;Gerhard Widmer+Austrian Research Institute for Artificial Intelligence>AUT>facility,"A considerable number of MIR tasks requires annotations at the note-level for the purpose of in-depth evaluation. A common means of obtaining accurately annotated data corpora is to start with a symbolic representation of a piece and generate corresponding audio data. This study investigates the effect of audio quality and source on the performance of two representative MIR algorithms – Onset Detection and Audio Alignment. Three kinds of audio material are compared: piano pieces generated using a freely available software synthesizer with its default instrument patches; a commercial high-quality sample library; and audio recordings made on a real (computer-controlled) grand piano. Also, the effect of varying richness of artistic changes in tempo and dynamics or natural asynchronies is examined. We show that the algorithms’ performance on the different datasets varies considerably, but synthesized audio does not necessarily yield better results."
89,Jacquelin A. Speck;Erik M. Schmidt;Brandon G. Morton;Youngmoo E. Kim,A Comparative Study of Collaborative vs. Traditional Musical Mood Annotation.,2011,https://doi.org/10.5281/zenodo.1417075,Jacquelin A. Speck+Drexel University>USA>education;Erik M. Schmidt+Drexel University>USA>education;Brandon G. Morton+Drexel University>USA>education;Youngmoo E. Kim+Drexel University>USA>education,"Organizing music by emotional association is a natural process for humans, but the ambiguous nature of emotion makes it a difficult task for machines. Automatic systems for music emotion recognition rely on ground truth data collected from humans, and more effective methods for collecting such data are being continuously developed. In previous work, we developed MoodSwings, an online collaborative game for crowdsourcing dynamic (per-second) mood ratings from multiple players within the two-dimensional arousal-valence (A-V) representation of emotion. MoodSwings has proven effective for data collection, but potential data effects caused by collaborative labeling have not yet been analyzed. In this work, we compare the effectiveness of MoodSwings to that of a more traditional data collection method, where annotation is performed by single, paid annotators. We implement a simplified labeling task to run on Amazon’s crowdsourcing engine, Mechanical Turk (MTurk), and analyze the labels collected with each method. A statistical comparison shows consistencies between MoodSwings and MTurk data, and we produce similar results using each as training data for automatic emotion production via supervised machine learning. Furthermore the new dataset collected via MTurk has been made available to the Music Information Retrieval community."
90,Jordan Bennett Louis Smith;John Ashley Burgoyne;Ichiro Fujinaga;David De Roure;J. Stephen Downie,Design and creation of a large-scale database of structural annotations.,2011,https://doi.org/10.5281/zenodo.1416884,Jordan B. L. Smith+University of Southern California>USA>education;J. Ashley Burgoyne+McGill University>CAN>education;Ichiro Fujinaga+McGill University>CAN>education;David De Roure+University of Oxford>GBR>education;J. Stephen Downie+University of Illinois at Urbana-Champaign>USA>education,"This paper describes the design and creation of an unprecedentedly large database of over 2400 structural annotations of nearly 1400 musical recordings. The database is intended to be a test set for algorithms that will be used to analyze a much larger corpus of hundreds of thousands of recordings, as part of the Structural Analysis of Large Amounts of Musical Information (SALAMI) project. This paper describes the design goals of the database and the practical issues that were encountered during its creation. In particular, we discuss the selection of the recordings, the development of an annotation format and procedure that adapts work by Peeters and Deruty [10], and the management and execution of the project. We also summarize some of the properties of the resulting corpus of annotations, including average inter-annotator agreement."
91,Andreas F. Ehmann;Mert Bay;J. Stephen Downie;Ichiro Fujinaga;David De Roure,Music Structure Segmentation Algorithm Evaluation: Expanding on MIREX 2010 Analyses and Datasets.,2011,https://doi.org/10.5281/zenodo.1418151,Andreas F. Ehmann+University of Illinois Urbana-Champaign>USA>education;Mert Bay+University of Illinois Urbana-Champaign>USA>education;J. Stephen Downie+University of Illinois Urbana-Champaign>USA>education;Ichiro Fujinaga+McGill University>CAN>education;David De Roure+University of Oxford>GBR>education,"Music audio structure segmentation has been a task in the Music Information Retrieval Evaluation eXchange (MIREX) since 2009. In 2010, five algorithms were evaluated against two datasets (297 and 100 songs) with an almost exclusive focus on western popular music. A new annotated dataset significantly larger in size and with a more diverse range of musical styles became available in 2011. This new dataset comprises over 1,300 songs spanning pop, jazz, classical, and world music styles. The algorithms from the 2010 iteration of MIREX are re-evaluated against this new dataset. This paper presents a detailed analysis of these evaluation results in order to gain a better understanding of the current state-of-the-art in automatic structure segmentation. These expanded analyses focus on the interaction of algorithm performance and rankings with datasets, musical styles, and annotation level. Because the new dataset contains multiple annotations for each song, we also introduce a baseline for expected human performance for this task."
92,Steven R. Ness;Shawn Trail;Peter F. Driessen;W. Andrew Schloss;George Tzanetakis,Music Information Robotics: Coping Strategies for Musically Challenged Robots.,2011,https://doi.org/10.5281/zenodo.1415868,Steven Ness+University of Victoria>CAN>education;Shawn Trail+University of Victoria>CAN>education;Peter Driessen+University of Victoria>CAN>education;Andrew Schloss+University of Victoria>CAN>education;George Tzanetakis+University of Victoria>CAN>education,"""In the past few years there has been a growing interest in music robotics. Robotic instruments that generate sound acoustically using actuators have been increasingly developed and used in performances and compositions over the past 10 years. Although such devices can be very sophisticated mechanically, in most cases they are passive devices that directly respond to control messages from a computer. In the few cases where more sophisticated control and feedback is employed it is in the form of simple mappings with little musical understanding. Several techniques for extracting musical information have been proposed in the field of music information retrieval. In most cases the focus has been the batch processing of large audio collections rather than real time performance understanding. In this paper we describe how such techniques can be adapted to deal with some of the practical problems we have experienced in our own work with music robotics. Of particular importance is the idea of self-awareness or proprioception in which the robot(s) adapt their behavior based on understanding the connection between their actions and sound generation through listening. More specifically we describe techniques for solving the following problems: 1) controller mapping 2) velocity calibration, and 3) gesture recognition."""
93,Trevor Knight;Finn Upham;Ichiro Fujinaga,The potential for automatic assessment of trumpet tone quality.,2011,https://doi.org/10.5281/zenodo.1418123,"Trevor Knight+Centre for Interdisciplinary Research in Music Media and Technology (CIRMMT), McGill University>CAN>education;Finn Upham+Centre for Interdisciplinary Research in Music Media and Technology (CIRMMT), McGill University>CAN>education;Ichiro Fujinaga+Centre for Interdisciplinary Research in Music Media and Technology (CIRMMT), McGill University>CAN>education","The goal of this study was to examine the possibility of training machine learning algorithms to differentiate between the performance of good notes and bad notes. Four trumpet players recorded a total of 239 notes from which audio features were extracted. The notes were subjectively graded by five brass players. The resulting dataset was used to train support vector machines with different groupings of ratings. Splitting the data set into two classes (“good” and “bad”) at the median rating, the classifier showed an average success rate of 72% when training and testing using cross-validation. Splitting the data into three roughly-equal classes (“good,” “medium,” and “bad”), the classifier correctly identified the class an average of 54% of the time. Even using seven classes, the classifier identified the correct class 46% of the time, which is better than the result expected from chance or from the strategy of picking the most populous class (36%)."
94,Spencer S. Topel;Michael A. Casey,Elementary Sources: Latent Component Analysis for Music Composition.,2011,https://doi.org/10.5281/zenodo.1417351,Spencer S. Topel+Dartmouth College>USA>education;Michael A. Casey+Dartmouth College>USA>education,"Complexity of music audio signals creates an access problem to specific musical objects or structures within the source samples. Instead of employing more commonly used audio analysis or production techniques to access features, we describe extraction of sub-mixtures from real-world audio using a Probabilistic Latent Component Analysis-based decomposition tool for music composition. This is highlighted with the presentation of a prior relevant compositional approach named Spectral Music along with a discussion of five compositions extending these principles using methods more commonly associated with source separation research."
95,Alison Mattek;Michael A. Casey,Cross-Modal Aesthetics from A Feature Extraction Perspective: A Pilot Study.,2011,https://doi.org/10.5281/zenodo.1414906,Alison Mattek+Dartmouth College>USA>education;Michael Casey+Dartmouth College>USA>education,"This paper investigates perceptual relationships between art in the auditory and visual domains. First, we conducted a behavioral experiment asking subjects to assess similarity between 10 musical recordings and 10 works of abstract art. We found a significant degree of agreement across subjects as to which images correspond to which audio, even though neither the audio nor the images possessed semantic content. Secondly, we sought to find the relationship between audio and images within a defined feature space that correlated with the subjective similarity judgments. We trained two regression models using leave-one-subject-out and leave-one-audio-out cross-validation respectively, and exhaustively evaluated each model's ability to predict features of subject-ranked similar images using only a given audio clip's features. A retrieval task used the predicted image features to retrieve likely related images from the data set. The task was evaluated using the ground truth of subjects' actual similarity judgments. Our results show a mean cross-validated prediction accuracy of 0.61 with p<0.0001 for the first model, and a mean prediction accuracy of 0.51 with p<0.03 for the second model."
96,Thierry Bertin-Mahieux;Daniel P. W. Ellis;Brian Whitman;Paul Lamere,The Million Song Dataset.,2011,https://doi.org/10.5281/zenodo.1415820,Thierry Bertin-Mahieux+Columbia University>USA>education;Daniel P.W. Ellis+Columbia University>USA>education;Brian Whitman+The Echo Nest>USA>company;Paul Lamere+The Echo Nest>USA>company,"We introduce the Million Song Dataset, a freely-available collection of audio features and metadata for a million contemporary popular music tracks. We describe its creation process, its content, and its possible uses. Attractive features of the Million Song Database include the range of existing resources to which it is linked, and the fact that it is the largest current research dataset in our field. As an illustration, we present year prediction as an example application, a task that has, until now, been difficult to study owing to the absence of a large set of suitable data. We show positive results on year prediction, and discuss more generally the future development of the dataset."
97,Julián Urbano;Diego Martín 0001;Mónica Marrero;Jorge Morato,Audio Music Similarity and Retrieval: Evaluation Power and Stability.,2011,https://doi.org/10.5281/zenodo.1417269,Julián Urbano+University Carlos III of Madrid>ESP>education;Diego Martín+University Carlos III of Madrid>ESP>education;Mónica Marrero+University Carlos III of Madrid>ESP>education;Jorge Morato+University Carlos III of Madrid>ESP>education,"In this paper we analyze the reliability of the results in the evaluation of Audio Music Similarity and Retrieval systems. We focus on the power and stability of the evaluation, that is, how often a significant difference is found between systems and how often these significant differences are incorrect. We study the effect of using different effectiveness measures with different sets of relevance judgments, for varying number of queries and alternative statistical procedures. Different measures are shown to behave similarly overall, though some are much more sensitive and stable than others. The use of different statistical procedures does improve the reliability of the results, and it allows using as little as half the number of queries currently used in MIREX evaluations while still offering very similar reliability levels. We also conclude that experimenters can be very confident that if a significant difference is found between two systems, the difference is indeed real."
98,Nicola Orio;David Rizo;Riccardo Miotto;Markus Schedl;Nicola Montecchio;Olivier Lartillot,MusiCLEF: a Benchmark Activity in Multimodal Music Information Retrieval.,2011,https://doi.org/10.5281/zenodo.1416506,Nicola Orio+University of Padova>ITA>education;David Rizo+University of Alicante>ESP>education;Riccardo Miotto+University of Padova>ITA>education;Nicola Montecchio+University of Padova>ITA>education;Markus Schedl+Johannes Kepler University>AUT>education;Olivier Lartillot+Academy of Finland>FIN>education,"This work presents the rationale, tasks and procedures of MusiCLEF, a novel benchmarking activity that has been developed along with the Cross-Language Evaluation Forum (CLEF). The main goal of MusiCLEF is to promote the development of new methodologies for music access and retrieval on real public music collections, which can combine content-based information, automatically extracted from music files, with contextual information, provided by users via tags, comments, or reviews. Moreover, MusiCLEF aims at maintaining a tight connection with real application scenarios, focusing on issues on music access and retrieval that are faced by professional users. To this end, this year’s evaluation campaign focused on two main tasks: automatic categorization of music to be used as soundtrack of TV shows and automatic identification of the digitized material of a music digital library."
