Unnamed: 0,Authors,Title,Year,Link,Authors with Affiliations,Abstract
68,Jose Pedro;Vadim Tarasov;Eloi Batlle;Enric Guaus;Jaume Masip,Industrial audio fingerprinting distributed system with CORBA and Web Services.,2004,https://doi.org/10.5281/zenodo.1414792,Jose P. G. Mahedero+Universitat Pompeu Fabra>ESP>education;Vadim Tarasov+Universitat Pompeu Fabra>ESP>education;Eloi Batlle+Universitat Pompeu Fabra>ESP>education;Enric Guaus+Universitat Pompeu Fabra>ESP>education;Jaume Masip+Universitat Pompeu Fabra>ESP>education,"With digital technologies, music content providers face serious challenges to protect their rights. Due to the widespread nature of music sources, it is very difficult to centralize the audio management. Audio fingerprinting allows the identification of audio content regardless of the audio format and without the need of additional metadata. Monitoring the audio being broadcasted by the TV and radio stations of a country requires the design and implementation of a scalable, robust and modular framework. We have chosen CORBA as distributed environment. The whole functionality needs to be decoupled from clients. To do so, Web services have been deployed. The audio identification core uses a Hidden Markov Model-based audio fingerprinting technology. The paper discusses the design and implementation issues of a complete distributing system that automatically monitors audio content, specifically music and commercials. Today, a working prototype of such a system already exists, and is dedicated to monitoring several radio and tv stations in Spain."
69,Anna Pienimäki;Kjell Lemström,Clustering Symbolic Music Using Paradigmatic and Surface Level Analyses.,2004,https://doi.org/10.5281/zenodo.1417447,Anna Pienimäki+University of Helsinki>FIN>education;Kjell Lemström+University of Helsinki>FIN>education,"In this paper, we describe a novel automatic cluster analy-
sis method for symbolic music. The method contains both
a surface level and a paradigmatic level analysing block
and works in two phases. In the first phase, each music
document of a collection is analysed separately: They are
first divided into phrases that are consequently fed on a
harmonic analyser. The paradigmatic structure of a given
music document is achieved comparing both the melodic
and the harmonic similarities among its phrases. In the
second phase, the collection of music documents is clus-
tered on the ground of their paradigmatic structures and
surface levels.
Our experimental results show that the
novel method finds some interesting, underlying similari-
ties that cannot be found using only surface level analysis."
70,Aggelos Pikrakis;Iasonas Antonopoulos;Sergios Theodoridis,Music meter and tempo tracking from raw polyphonic audio.,2004,https://doi.org/10.5281/zenodo.1416348,Aggelos Pikrakis+University of Athens>GRC>education;Iasonas Antonopoulos+University of Athens>GRC>education;Sergios Theodoridis+University of Athens>GRC>education,"This paper presents a method for the extraction of music meter and tempo from raw polyphonic audio recordings, assuming that music meter remains constant throughout the recording. Although this assumption can be restrictive for certain musical genres, it is acceptable for a large corpus of folklore eastern music styles, including Greek traditional dance music. Our approach is based on the self-similarity analysis of the audio recording and does not assume the presence of percussive instruments. Its novelty lies in the fact that music meter and tempo are jointly determined. The method has been applied to a variety of musical genres, in the context of Greek traditional music where music meter can be 2/4, 3/4, 4/4, 5/4, 7/8, 9/8, 12/8 and tempo ranges from 40bpm to 330bpm. Experiments have, so far, demonstrated the efficiency of our method (music meter and tempo were successfully extracted for over 95% of the recordings)."
71,Christopher Raphael,A Hybrid Graphical Model for Aligning Polyphonic Audio with Musical Scores.,2004,https://doi.org/10.5281/zenodo.1416500,Christopher Raphael+Indiana University>USA>education,"We present a new method for establishing an alignment between a polyphonic musical score and a corresponding sampled audio performance. The method uses a graphical model containing both discrete variables, corresponding to score position, as well as a continuous latent tempo process. We use a simple data model based only on the pitch content of the audio signal. The data interpretation is defined to be the most likely configuration of the hidden variables, given the data, and we develop computational methodology for this task using a variant of dynamic programming involving parametrically represented continuous variables. Experiments are presented on a 55-minute hand-marked orchestral test set."
72,Christopher Raphael,Demonstration of 'Music Plus One'--- a System for Orchestral Musical Accompanimen.,2004,https://doi.org/10.5281/zenodo.1417899,Christopher Raphael+Indiana University>USA>education,""""""
73,Josh Reiss;Mark B. Sandler,Audio Issues In MIR Evaluation.,2004,https://doi.org/10.5281/zenodo.1415840,"Josh Reiss+Queen Mary, University of London>GBR>education;Mark Sandler+Queen Mary, University of London>GBR>education","Several projects are underway to create music testbeds to suit the needs of the music analysis and music information retrieval (MIR) communities. There are also plans to unify testbeds into a distributed grid. Thus the issue of audio file formats has come to the forefront. The creators of a music library or MIR testbed are confronted with many questions pertaining to file formats, their quality, metadata, and copyright issues. We discuss the various formats, their advantages and disadvantages, and give a set of guidelines and recommendations. This document is a positional paper. It is intended to foster discussion and not as a definitive statement. Nevertheless, it is hoped that the proposals put forth here may serve as a guideline to use in construction of an MIR evaluation testbed."
74,Vegard Sandvold;Fabien Gouyon;Perfecto Herrera,Drum sound classification in polyphonic audio recordings using localized sound models.,2004,https://doi.org/10.5281/zenodo.1415808,Vegard Sandvold+University of Oslo>NOR>education|Universitat Pompeu Fabra>ESP>education|Universitat Pompeu Fabra>ESP>education;Fabien Gouyon+Universitat Pompeu Fabra>ESP>education|Universitat Pompeu Fabra>ESP>education;Perfecto Herrera+Universitat Pompeu Fabra>ESP>education|Universitat Pompeu Fabra>ESP>education,"This paper deals with automatic percussion classification in polyphonic audio recordings, focusing on kick, snare and cymbal sounds. We present a feature-based sound modeling approach that combines general, prior knowledge about the sound characteristics of percussion instrument families (general models) with on-the-fly acquired knowledge of recording-specific sounds (localized models). This way, high classification accuracy can be obtained with remarkably simple sound models. The accuracy is on average around 20% higher than with general models alone."
75,Ryan Scherle;Donald Byrd,The Anatomy of a Bibliographic Search System for Music.,2004,https://doi.org/10.5281/zenodo.1417789,Ryan Scherle+Indiana University>USA>education;Donald Byrd+Indiana University>USA>education,"Traditional library catalog systems have been effective in providing access to collections of books, films, and other material. However, they have many limitations when it comes to finding musical information, which has significantly different, and in many ways more complex, structure. The Variations2 search system is an alternative designed specifically to aid users in searching for music. It leverages a rich set of bibliographic data records, expressing relationships between creators of music and their creations. These records enable musicians to search for music using familiar terms and relationships, rather than trying to decipher the methods libraries typically use to organize musical items. This paper describes the design and implementation of the system that makes these searches possible."
76,Shai Shalev-Shwartz;Joseph Keshet;Yoram Singer,Learning to Align Polyphonic Music.,2004,https://doi.org/10.5281/zenodo.1416546,Shai Shalev-Shwartz+The Hebrew University>ISR>education;Joseph Keshet+The Hebrew University>ISR>education;Yoram Singer+The Hebrew University>ISR>education,"We describe an efficient learning algorithm for aligning a symbolic representation of a musical piece with its acoustic counterpart. Our method employs a supervised learning approach by using a training set of aligned symbolic and acoustic representations. The alignment function we devise is based on mapping the input acoustic-symbolic representation along with the target alignment into an abstract vector-space. Building on techniques used for learning support vector machines (SVM), our alignment function distills to a classifier in the abstract vector-space which separates correct alignments from incorrect ones. We describe a simple iterative algorithm for learning the alignment function and discuss its formal properties. We use our method for aligning MIDI and MP3 representations of polyphonic recordings of piano music. We also compare our discriminative approach to a generative method based on a generalization of hidden Markov models. In all of our experiments, the discriminative method outperforms the HMM-based method."
77,Prarthana Shrestha;Ton Kalker,Audio Fingerprinting In Peer-to-peer Networks.,2004,https://doi.org/10.5281/zenodo.1417457,Prarthana Shrestha+Eindhoven University of Technology>NLD>education;Ton Kalker+Eindhoven University of Technology>NLD>education,"Despite the immense potential of Peer-to-Peer (P2P) networks in facilitating collaborative applications, they have become largely known as a free haven for pirated music swapping. In this paper, we present an approach wherein the collective computational power of the P2P networks is exploited to combat the problem of unauthorized music file sharing. We propose a distributed system based on audio fingerprinting, that makes it possible to recognize the music content present in the network. When the contents are identified, the network can take special measures against the use or sharing of unauthorized music. This proposed system is self-adapting, and robust. The foregoing properties make the system particularly suitable for use in dynamic and heterogeneous environment of P2P networks. In order to investigate the behavior of the proposed system, a system-level model has been created using the Parallel Object Oriented Specification Language (POOSL). This model was used to investigate an optimal system configuration that maximizes the identification of the content."
78,Jane Singer,Creating a nested melodic representation: competition and cooperation among bottom-up and top-down Gestalt principles.,2004,https://doi.org/10.5281/zenodo.1417965,Jane Singer+The Hebrew University of Jerusalem>ISR>education,"A set of principles (based on Gestalt theory) governing how we group notes into meaningful groups has been widely accepted in the literature. Based on these principles, many divergent theories of melodic segmentation and representation have been proposed. However, these theories have not succeeded in achieving a comprehensive and verifiable representation of melody. This is largely due to the fact that multiple competing segmenting factors produce, for any single melody, a large number of possible segmentations and therefore representations. Here a model is proposed, which incorporates widely accepted principles of segmentation. These rules govern three types of factors: (1) changes in proximity (for producing disjunctive segmentation), (2) changes in overall contour and intervallic texture and (3) patterns and periodicity that create parallelism among segments. Because of the nature of the segmentation rules, these same rules establish the attributes of the groups they produce. Based on original research in Singer 2004, principles for establishing preferences among competing rules are formulated in order to create a few preferred representations for approximately 1,000 monophonic folksongs."
79,J. Stephen Downie;Joe Futrelle;David K. Tcheng,"The International Music Information Retrieval Systems Evaluation Laboratory: Governance, Access and Security.",2004,https://doi.org/10.5281/zenodo.1415120,J. Stephen Downie+University of Illinois at Urbana-Champaign>USA>education;Joe Futrelle+University of Illinois at Urbana-Champaign>USA>education;David Tcheng+University of Illinois at Urbana-Champaign>USA>education,"The IMIRSEL (International Music Information Retrieval Systems Evaluation Laboratory) project provides an unprecedented platform for evaluating Music Information Retrieval (MIR) and Music Digital Library (MDL) techniques, by bringing together large corpora and significant computational resources with the necessary rights management and technical infrastructure to support a variety of MIR/MDL research areas. The standardized research collection being deployed represents a large and diverse corpus of musical examples, which we are hosting in our secure environment for use in evaluating MIR/MDL algorithms. Grid services and NCSA's D2K machine learning environment provide a powerful, high-performance, and secure framework for designing, optimising, and executing complex MIR/MDL evaluation applications. IMIRSEL provides a community resource for researchers who would otherwise not be able to afford the content rights and computational resources to carry out large-scale MIR/MDL evaluations."
80,Josh Stoddard;Christopher Raphael;Paul E. Utgoff,Well-Tempered Spelling: A Key Invariant Pitch Spelling Algorithm.,2004,https://doi.org/10.5281/zenodo.1414762,Joshua Stoddard+University of Massachusetts Amherst>USA>education;Christopher Raphael+University of Massachusetts Amherst>USA>education;Paul E. Utgoff+University of Massachusetts Amherst>USA>education,"In this paper is described a data-driven algorithm for the functionally correct spelling of MIDI pitch values in terms of Western musical notation. Input is in the form of MIDI files containing accurate pitch and rhythmic information with corresponding ground-truth spelling information for training and evaluation. The algorithm recovers harmonic information from the MIDI data and spells pitches according to their relation to the local tonic. The algorithm achieved 94.98% accuracy on the pitches that required accidentals in the local key and 99.686% overall. Voice-leading resolution was found to be the best feature of those used to infer the correct spelling. Also, this paper outlines great potential for improvement under this model."
81,Craig Stuart Sapp;Yi-Wen Liu;Eleanor Selfridge-Field,Search Effectiveness Measures for Symbolic Music Queries in Very Large Databases.,2004,https://doi.org/10.5281/zenodo.1417913,Craig Stuart Sapp+Stanford University>USA>education;Yi-Wen Liu+Stanford University>USA>education;Eleanor Selfridge-Field+Stanford University>USA>education,"In the interest of establishing robust benchmarks for search efficiency, we conducted a series of tests on symbolic databases of musical incipits and themes taken from several diverse repertories. The results we report differ from existing studies in four respects: (1) the data quantity is much larger (c. 100,000 entries); (2) the levels of melodic and rhythmic precision are more refined; (3) anchored and unanchored searches were differentiated; and (4) results from joint pitch-and-rhythm searches were compared with those for pitch-only searches. The search results were evaluated using a theoretical approach which seeks to rank the number of symbols required to achieve “sufficient uniqueness”. How far into a melody must a search go in order to find an item which is unmatched by any other of the available items? How much does the answer depend on the specificity of the query? How much does anchoring the query matter? How much does the result depend on the nature of the repertory? We offer experimental results for these questions."
82,Iman S. H. Suyoto;Alexandra L. Uitdenbogerd,Exploring Microtonal Matching.,2004,https://doi.org/10.5281/zenodo.1416656,Iman S. H. Suyoto+RMIT University>AUS>education;Alexandra L. Uitdenbogerd+RMIT University>AUS>education,"Most research into music information retrieval thus far has only examined music from the western tradition. However, music of other origins often conforms to different tuning systems. Therefore there are problems both in representing this music as well as finding matches to queries from these diverse tuning systems. We discuss the issues associated with microtonal music retrieval and present some preliminary results from an experiment in applying scoring matrices to microtonal matching."
83,Sara Taheri-Panah;Andrew MacFarlane 0001,Music Information Retrieval systems: why do individuals use them and what are their needs?.,2004,https://doi.org/10.5281/zenodo.1416334,S. Taheri-Panah+City University>GBR>education;A. MacFarlane+City University>GBR>education,"To date there has been very little research conducted on the behaviour of music information retrieval (MIR) users, in spite of the immense popularity of free music retrieval systems available on the Internet. In this study we examine the issue of music seeking behaviour through the examination of users life style effect of three different age groups using questionnaires. It was found that lifestyles had a significant impact on users need for music and hence their music seeking behaviour. The importance of social networks in music information seeking was reinforced in this study. An experiment was conducted with three different types of search on the Kazaa MIR system and the participants interviewed in order to collect data. Users found the Kazaa system intuitive and easy to use. Searchers used both song titles and lyrics for finding relevant music items. The insights provided by this study can be of assistance in the development of user focused Internet MIR systems."
84,Haruto Takeda;Takuya Nishimoto;Shigeki Sagayama,Rhythm and Tempo Recognition of Music Performance from a Probabilistic Approach.,2004,https://doi.org/10.5281/zenodo.1418209,Haruto Takeda+The University of Tokyo>JPN>education;Takuya Nishimoto+The University of Tokyo>JPN>education;Shigeki Sagayama+The University of Tokyo>JPN>education,"This paper concerns both rhythm recognition and tempo analysis of expressive music performance based on a probabilistic approach. In rhythm recognition, the modern continuous speech recognition technique is applied to find the most likely intended note sequence from the given sequence of fluctuating note durations in the performance. Combining stochastic models of note durations deviating from the nominal lengths and a probabilistic grammar representing possible sequences of notes, the problem is formulated as a maximum a posteriori estimation that can be implemented using efficient search based on the Viterbi algorithm. With this, significant improvements compared with conventional “quantization” techniques were found. Tempo analysis is performed by fitting the observed tempo with parametric tempo curves in order to extract tempo dynamics and characteristics of performance to use. Tempo-change timings and parameter values in tempo curve models are estimated through the segmental k-means algorithm. Experimental results of rhythm recognition and tempo analysis applied to classical and popular music performances are also demonstrated."
85,Richard Terrat,Pregroup Grammars for Chords.,2004,https://doi.org/10.5281/zenodo.1416702,Richard G. Terrat+LIRMM/CNRS>FRA>facility|IRCAM>FRA>facility,"Pregroups had been conceived as an algebraic tool to recognize grammatically well-formed sentences in natural languages [3]. Here we wish to use pregroups to recognize well-formed chords of pitches, for a given definition of those chords. We show how a judicious choice of basic and simple types allows a context-free grammatical description. Then we use the robustness property to extend the set of well-formed chords in a simple way. Finally we argue in favor of an utilization of pregroups grammars for the recognition and classification of chord sequences."
86,Adam R. Tindale;Ajay Kapur;George Tzanetakis;Ichiro Fujinaga,Retrieval of percussion gestures using timbre classification techniques.,2004,https://doi.org/10.5281/zenodo.1416612,Adam Tindale+McGill University>CAN>education;Ajay Kapur+University of Victoria>CAN>education;George Tzanetakis+University of Victoria>CAN>education;Ichiro Fujinaga+McGill University>CAN>education,"Musicians are able to recognise the subtle differences in timbre produced by different playing techniques on an instrument, yet there has been little research into achieving this with a computer. This paper will demonstrate an automatic system that can successfully recognise different timbres produced by different performance techniques and classify them using signal processing and classification tools. Success rates over 90% are achieved when classifying snare drum timbres produced by different playing techniques."
87,Marc Torrens;Patrick Hertzog;Josep Lluís Arcos,Visualizing and Exploring Personal Music Libraries.,2004,https://doi.org/10.5281/zenodo.1414746,"Marc Torrens+MusicStrands Inc.>USA>company;Patrick Hertzog+EPFL>CHE>education;Josep-Lluís Arcos+IIIA, CSIC>ESP>facility","Nowadays, music fans are beginning to massively use mobile digital music players and dedicated software to organize and play large collections of music. In this context, users deal with huge music libraries containing thousands of tracks. Such a huge volume of music easily overwhelms users when selecting the music to listen or when organizing their collections. Music player software with visualizations based on textual lists and organizing features such as smart playlists are not really enough for helping users to efficiently manage their libraries. Thus, we propose new graphical visualizations and their associated features to allow users to better organize their personal music libraries and therefore also to ease selection later on."
88,Godfried T. Toussaint,A Comparison of Rhythmic Similarity Measures.,2004,https://doi.org/10.5281/zenodo.1416812,Godfried T. Toussaint+McGill University>CAN>education,"Traditionally, rhythmic similarity measures are compared according to how well rhythms may be recognized with them, how efficiently they can be retrieved from a database, or how well they model human perception and cognition. In contrast, here similarity measures are compared on the basis of how much insight they provide about the structural inter-relationships that exist within families of rhythms, when phylogenetic trees and graphs are computed from the distance matrices determined by these similarity measures. Phylogenetic analyses yield insight into the evolution of rhythms and may uncover interesting ancestral rhythms."
89,Ken'ichi Toyoda;Kenzi Noike;Haruhiro Katayose,Utility System For Constructing Database Of Performance Deviations.,2004,https://doi.org/10.5281/zenodo.1417953,Ken’ichi Toyoda+Kwansei Gakuin University>JPN>education;Kenzi Noike+Kwansei Gakuin University>JPN>education;Haruhiro Katayose+Kwansei Gakuin University>JPN>education,"Demand for music databases is increasing for the studies of musicology and music informatics. Our goal is to construct databases that contain deviations of tempo, and dynamics, start-timing, and duration of each note. This paper describes a procedure based on hybrid use of DP Matching and HMM that efficiently extracts deviations from MIDI-formatted expressive human performances. The algorithm of quantizing the start-timing of the notes has been successfully tested on a database of ten expressive piano performances. It gives an accuracy of 92.9% when one note per bar is given as the guide. This paper also introduces tools provided so that the public can make use of our database on the web."
90,Wei-Ho Tsai;Hsin-Min Wang,Towards Automatic Identification Of Singing Language In Popular Music Recordings.,2004,https://doi.org/10.5281/zenodo.1417511,Wei-Ho Tsai+Academia Sinica>TWN>education|Institute of Information Science>Unknown>Unknown;Hsin-Min Wang+Academia Sinica>TWN>education|Institute of Information Science>Unknown>Unknown,"The automatic analysis of singing from music is an important and challenging issue within the research target of content-based retrieval of music information. As part of this research target, this study presents a first attempt to automatically identify the language sung in a music recording. It is assumed that each language has its own set of constraints that specify which of the basic linguistic events present in a singing process are allowed to follow another. The acoustic structure of individual languages may, thus, be characterized by statistically modeling those constraints. To this end, the proposed method employs vector clustering to convert a singing signal from its spectrum-based feature representation into a sequence of smaller basic phonological units. The dynamic characteristics of the sequence are then analyzed by using bigram language models. Since the vector clustering is performed in an unsupervised manner, the resulting system does not use sophisticated linguistic knowledge and, thus, is easily portable to new language sets. In addition, to eliminate the interference of background music, we leverage the statistical estimation of a piece’s music background so that the vector clustering is relevant to the solo singing voices in the accompanied signals."
