Unnamed: 0,Authors,Title,Year,Link,Authors with Affiliations,Abstract
60,Florence Levé;Richard Groult;Guillaume Arnaud;Cyril Séguin;Rémi Gaymay;Mathieu Giraud,Rhythm Extraction from Polyphony Symbolic Music.,2011,https://doi.org/10.5281/zenodo.1416368,Florence Levé+Université de Picardie Jules Verne>FRA>education;Richard Groult+Université de Picardie Jules Verne>FRA>education;Guillaume Arnaud+Université de Picardie Jules Verne>FRA>education;Cyril Séguin+Université de Picardie Jules Verne>FRA>education;Rémi Gaymay+Université Lille 1>FRA>education;Mathieu Giraud+Université Lille 1>FRA>education,"In this paper, we focus on the rhythmic component of symbolic music similarity, proposing several ways to extract a monophonic rhythmic signature from a symbolic polyphonic score. To go beyond the simple extraction of all time intervals between onsets (notes on extraction), we select notes according to their length (short and long extractions) or their intensities (intensity+/− extractions). Once the rhythm is extracted, we use dynamic programming to compare several sequences. We report results of analysis on the size of rhythm patterns that are specific to a unique piece, as well as experiments on similarity queries (ragtime music and Bach chorale variations). These results show that long and intensity+ extractions are often good choices for rhythm extraction. Our conclusions are that, even from polyphonic symbolic music, rhythm alone can be enough to identify a piece or to perform pertinent music similarity queries, especially when using wise rhythm extractions."
61,George Sioros;Carlos Guedes,Complexity Driven Recombination of MIDI Loops.,2011,https://doi.org/10.5281/zenodo.1415804,George Sioros+University of Porto>PRT>education;Carlos Guedes+University of Porto>PRT>education|INESC - Porto>PRT>facility,"An algorithm and a software application for recombining in real time MIDI drum loops that makes use of a novel analysis of rhythmic patterns that sorts them in order of their complexity is presented. We measure rhythmic complexity by comparing each rhythmic pattern found in the loops to a metrical template characteristic of its time signature. The complexity measure is used to sort the MIDI loops prior to utilizing them in the recombination algorithm. This way, the user can effectively control the complexity and variation in the generated rhythm during performance."
62,Michael Scott Cuthbert;Christopher Ariza;Lisa Friedland,Feature Extraction and Machine Learning on Symbolic Music using the music21 Toolkit.,2011,https://doi.org/10.5281/zenodo.1416288,Michael Scott Cuthbert+M.I.T.>USA>education;Christopher Ariza+M.I.T.>USA>education;Lisa Friedland+University of Massachusetts Amherst>USA>education,"Machine learning and artificial intelligence have great potential to help researchers understand and classify musical scores and other symbolic musical data, but the difficulty of preparing and extracting characteristics (features) from symbolic scores has hindered musicologists (and others who examine scores closely) from using these techniques. This paper describes the “feature” capabilities of music21, a general-purpose, open source toolkit for analyzing, searching, and transforming symbolic music data. The features module of music21 integrates standard feature-extraction tools provided by other toolkits, includes new tools, and also allows researchers to write new and powerful extraction methods quickly. These developments take advantage of the system’s built-in capacities to parse diverse data formats and to manipulate complex scores (e.g., by reducing them to a series of chords, determining key or metrical strength automatically, or integrating audio data). This paper’s demonstrations combine music21 with the data mining toolkits Orange and Weka to distinguish works by Monteverdi from works by Bach and German folk music from Chinese folk music."
63,Phillip B. Kirlin;David D. Jensen,Probabilistic Modeling of Hierarchical Music Analysis.,2011,https://doi.org/10.5281/zenodo.1417119,Phillip B. Kirlin+University of Massachusetts Amherst>USA>education;David D. Jensen+University of Massachusetts Amherst>USA>education,"Hierarchical music analysis, as exemplified by Schenkerian analysis, describes the structure of a musical composition by a hierarchy among its notes. Each analysis defines a set of prolongations, where musical objects persist in time even though others are present. We present a formal model for representing hierarchical music analysis, probabilistic interpretations of that model, and an efficient algorithm for computing the most probable analysis under these interpretations. We represent Schenkerian analyses as maximal outerplanar graphs (MOPs). We use this representation to encode the largest known data set of computer-processable Schenkerian analyses, and we use these data to identify statistical regularities in the human-generated analyses. We show that a dynamic programming algorithm can be applied to these regularities to identify the maximum likelihood analysis for a given piece of music."
64,Jonathan Bragg;Elaine Chew;Stuart M. Shieber,Neo-Riemannian Cycle Detection with Weighted Finite-State Transducers.,2011,https://doi.org/10.5281/zenodo.1416152,"Jonathan Bragg+Harvard University>USA>education;Elaine Chew+Queen Mary, University of London>GBR>education;Stuart Shieber+Harvard University>USA>education","This paper proposes a finite-state model for detecting harmonic cycles as described by neo-Riemannian theorists. Given a string of triads representing a harmonic analysis of a piece, the task is to identify and label all substrings corresponding to these cycles with high accuracy. The solution method uses a noisy channel model implemented with weighted finite-state transducers. On a dataset of four works by Franz Schubert, our model predicted cycles in the same regions as cycles in the ground truth with a precision of 0.18 and a recall of 1.0. The recalled cycles had an average edit distance of 3.2 insertions or deletions from the ground truth cycles, which average 6.4 labeled triads in length. We suggest ways in which our model could be used to contribute to current work in music theory, and be generalized to other music pattern-finding applications."
65,Esben Paul Bugge;Kim Lundsteen Juncher;Brian Søborg Mathiasen;Jakob Grue Simonsen,Using Sequence Alignment and Voting to Improve Optical Music Recognition from Multiple Recognizers.,2011,https://doi.org/10.5281/zenodo.1418175,Esben Paul Bugge+University of Copenhagen>DNK>education;Kim Lundsteen Juncher+University of Copenhagen>DNK>education;Brian Søborg Mathiasen+University of Copenhagen>DNK>education;Jakob Grue Simonsen+University of Copenhagen>DNK>education,"Digitalizing sheet music using Optical Music Recognition (OMR) is error-prone, especially when using noisy images created from scanned prints. Inspired by DNA-sequence alignment, we devise a method to use multiple sequence alignment to automatically compare output from multiple third party OMR tools and perform automatic error-correction of pitch and duration of notes. We perform tests on a corpus of 49 one-page scores of varying quality. Our method on average reduces the amount of errors from an ensemble of 4 commercial OMR tools. The method achieves, on average, fewer errors than each recognizer by itself, but statistical tests show that it is significantly better than only 2 of the 4 commercial recognizers. The results suggest that recognizers may be improved somewhat by sequence alignment and voting, but that more elaborate methods may be needed to obtain substantial improvements. All software, scanned music data used for testing, and experiment protocols are open source and available at: http://code.google.com/p/omr-errorcorrection/"
66,Verena Thomas;Christian Wagner 0003;Michael Clausen,OCR based post processing of OMR for the recovery of transposing instruments in complex orchestral scores.,2011,https://doi.org/10.5281/zenodo.1415790,Verena Thomas+University of Bonn>DEU>education;Christian Wagner+University of Bonn>DEU>education;Michael Clausen+University of Bonn>DEU>education,"Given a scanned score page, Optical Music Recognition (OMR) attempts to reconstruct all contained music information. However, the available OMR systems lack the ability to recognize transposition information contained in complex orchestral scores. An additional unsolved OMR problem is the handling of orchestral scores using compressed notation. Here, the information of which instrument has to play which staff is crucial for a correct interpretation of the score. But this mapping is lost along the pages of the score during the OMR process. In this paper, we present a method for retrieving the instrumentation and transposition information of orchestral scores. In our approach, we combine the results of Optical Character Recognition (OCR) and OMR to regain the information available through text annotations of the score. In addition, a method to reconstruct the instrument and transposition information for staves where text annotations were omitted or not recognized is presented. In an evaluation we analyze the impact of transposition information on the quality of score-audio synchronizations of orchestral music. The results show that the knowledge of transposing instruments improves the synchronization accuracy and that our method helps in regaining this knowledge."
67,Masahiro Niitsuma;Yo Tomita,Classifying Bach's Handwritten C-Clefs.,2011,https://doi.org/10.5281/zenodo.1415822,"Masahiro Niitsuma+Queen's University, Belfast>GBR>education;Yo Tomita+Queen's University, Belfast>GBR>education","The aim of this study is to explore how we could use computational technology to help determination of the chronology of music manuscripts. Applying a battery of techniques to Bach’s manuscripts reveals the limitation in current image processing techniques, thereby clarifying future tasks. Analysis of C-clefs, the chosen musical symbol for this study, extracted from Bach’s manuscripts dating from 1708–1748, is also carried out. Random forest using 15 features produces significant accuracy for chronological classification."
68,Gabriel Vigliensoni;John Ashley Burgoyne;Andrew Hankinson;Ichiro Fujinaga,Automatic Pitch Detection in Printed Square Notation.,2011,https://doi.org/10.5281/zenodo.1415580,Gabriel Vigliensoni+McGill University>CAN>education;John Ashley Burgoyne+McGill University>CAN>education;Andrew Hankinson+McGill University>CAN>education;Ichiro Fujinaga+McGill University>CAN>education,"In this paper we present our research in the development of a pitch-finding system to extract the pitches of neumes—some of the oldest representations of pitch in Western music—from the Liber Usualis, a well-known compendium of plainchant as used in the Roman Catholic church. Considerations regarding the staff position, staff removal, space- and line-zones, as well as how we treat specific neume classes and modifiers are covered. This type of notation presents a challenge for traditional optical music recognition (OMR) systems because individual note pitches are indivisible from the larger ligature group that forms the neume. We have created a dataset of correctly-notated transcribed chant for comparing the performance of different variants of our pitch-finding system. The best result showed a recognition rate of 97% tested with more than 2000 neumes."
69,Kerstin Neubarth;Mathieu Bergeron;Darrell Conklin,Associations between Musicology and Music Information Retrieval.,2011,https://doi.org/10.5281/zenodo.1416564,"Kerstin Neubarth+Canterbury Christ Church University>GBR>education;Mathieu Bergeron+McGill University>CAN>education;Darrell Conklin+Universidad del País Vasco>ESP>education|IKERBASQUE, Basque Foundation for Science>ESP>facility","A higher level of interdisciplinary collaboration between music information retrieval (MIR) and musicology has been proposed both in terms of MIR tools for musicology, and musicological motivation and interpretation of MIR research. Applying association mining and content citation analysis methods to musicology references in ISMIR papers, this paper explores which musicological subject areas are of interest to MIR, whether references to specific musicology areas are significantly over-represented in specific MIR areas, and precisely why musicology is cited in MIR."
70,Dingding Wang 0001;Mitsunori Ogihara,Potential Relationship Discovery in Tag-Aware Music Style Clustering and Artist Social Networks.,2011,https://doi.org/10.5281/zenodo.1418221,Dingding Wang+University of Miami>USA>education|Center for Computational Science>USA>facility;Mitsunori Ogihara+University of Miami>USA>education|Center for Computational Science>USA>facility,"With the rapid growth of music information and data in today’s ever changing world, exploring and analyzing music style has become more and more difficult. Traditional content-based methods for music style analysis and newly emerged tag-based methods usually assume music items are independent of each other. However, in real world applications, do there exist some relationships among them. In this paper, we construct the social relation graph among different music artists by extracting the friendship information from social media such as Twitter, and incorporate the generated social networking graph into tag-based music style clustering. Experiments on real data show the effectiveness of this novel integration of different information sources."
71,Charith Gunaratna;Evan Stoner;Ronaldo Menezes,Using Network Sciences to Rank Musicians and Composers in Brazilian Popular Music.,2011,https://doi.org/10.5281/zenodo.1415818,Charith Gunaratna+Florida Tech>USA>education;Evan Stoner+Florida Tech>USA>education;Ronaldo Menezes+Florida Tech>USA>education,Music fascinates and touches most people. This fascination leads to opinions about the music pieces that reflects people’s exposure and personal experience. This inherent bias of people towards music indicates that personal opinion is inappropriate for defining the quality of music and musicians. This paper takes a holistic view of the problem and delves into the understanding of the structure of Brazilian music rooted in Network Sciences. In this paper we work with a large database of albums of Brazilian music and study the structure of collaborations between all the musicians and composers. The collaboration is modelled as a social network of musicians and then analyzed from different perspectives with the goal of describing what we call the structure of that musical genre as well as provide a ranking of musicians and composers.
72,Débora C. Corrêa;Alexandre L. M. Levada;Luciano da F. Costa,Finding Community Structure in Music Genres Networks.,2011,https://doi.org/10.5281/zenodo.1418147,D´ebora C. Corrˆea+Instituto de Física de São Carlos>BRA>education;Luciano da F. Costa+Instituto de Física de São Carlos>BRA>education;Alexandre L. M. Levada+Universidade Federal de São Carlos>BRA>education,"Complex networks have shown to be promising mechanisms to represent several aspects of nature, since their topological and structural features help in the understanding of relations, properties and intrinsic characteristics of the data. In this context, we propose to build music networks in order to find community structures of music genres. Our main contributions are twofold: 1) Define a totally unsupervised approach for music genres discrimination; 2) Incorporate topological features in music data analysis. We compared different distance metrics and clustering algorithms. Each song is represented by a vector of conditional probabilities for the note values in its percussion track. Initial results indicate the effectiveness of the proposed methodology."
73,Robert Macrae;Simon Dixon,"Guitar Tab Mining, Analysis and Ranking.",2011,https://doi.org/10.5281/zenodo.1416476,Robert Macrae+Queen Mary University of London>GBR>education;Simon Dixon+Queen Mary University of London>GBR>education,"With over 4.5 million tablatures and chord sequences (collectively known as tabs), the web holds vast quantities of hand annotated scores in non-standardised text files. These scores are typically error-prone and incomplete, and tab collections contain many duplicates, making retrieval of high quality tabs difficult. Despite this, tabs are by far the most popular means of sharing musical instructions on the internet. We have developed tools that use text analysis and alignment for the automatic retrieval, interpretation and analysis of such tabs in order to filter and estimate the most accurate tabs from the multitude available. We show that the standard means of ranking tabs, such as search engine ranks or user ratings, have little correlation with the accuracy of a tab and that a better ranking method is to use features such as the concurrency between tabs of the same song. We also compare the quality of top-ranked tabs with state-of-the-art chord transcription output and find that the latter provides a more reliable source of chord symbols with an accuracy rate 10% higher than the ranked hand annotations."
74,Cory McKay;David Bainbridge 0001,A Musical Web Mining and Audio Feature Extraction Extension to The Greenstone Digital Library Software.,2011,https://doi.org/10.5281/zenodo.1415006,Cory McKay+Marianopolis College>CAN>education;David Bainbridge+University of Waikato>NZL>education,"This paper describes updates to the Greenstone open source digital library software that significantly expand its functionality with respect to music. The first of the two major improvements now allows Greenstone to extract and store classification-oriented features from audio files using a newly updated version of the jAudio software. The second major improvement involves the implementation and integration of the new jSongMiner software, which provides Greenstone with a framework for automatically identifying audio recordings using audio fingerprinting and then extracting extensive metadata about them from a variety of resources available on the Internet. Several illustrative use cases and case studies are discussed."
75,Sefki Kolozali;Mathieu Barthet;György Fazekas;Mark B. Sandler,Knowledge Representation Issues in Musical Instrument Ontology Design.,2011,https://doi.org/10.5281/zenodo.1416142,"Sefki Kolozali+Centre for Digital Music, Queen Mary University of London>GBR>education;Mathieu Barthet+Centre for Digital Music, Queen Mary University of London>GBR>education;György Fazekas+Centre for Digital Music, Queen Mary University of London>GBR>education;Mark Sandler+Centre for Digital Music, Queen Mary University of London>GBR>education","This paper presents preliminary work on musical instruments ontology design, and investigates heterogeneity and limitations in existing instrument classification schemes. Numerous research to date aims at representing information about musical instruments. The works we examined are based on the well known Hornbostel and Sach’s classification scheme. We developed representations using the Ontology Web Language (OWL), and compared terminological and conceptual heterogeneity using SPARQL queries. We found evidence to support that traditional designs based on taxonomy trees lead to ill-defined knowledge representation, especially in the context of an ontology for the Semantic Web. In order to overcome this issue, it is desirable to have an instrument ontology that exhibits a semantically rich structure."
76,György Fazekas;Mark B. Sandler,The Studio Ontology Framework.,2011,https://doi.org/10.5281/zenodo.1417735,György Fazekas+Queen Mary University of London>GBR>education;Mark B. Sandler+Queen Mary University of London>GBR>education,"This paper introduces the Studio Ontology Framework for describing and sharing detailed information about music production. The primary aim of this ontology is to capture the nuances of record production by providing an explicit, application and situation independent conceptualisation of the studio environment. We may use the ontology to describe real-world recording scenarios involving physical hardware, or (post) production on a personal computer. It builds on Semantic Web technologies and previously published ontologies for knowledge representation and knowledge sharing."
77,Ruofeng Chen;Ming Li,Music Structural Segmentation by Combining Harmonic and Timbral Information.,2011,https://doi.org/10.5281/zenodo.1414774,"Ruofeng Chen+Georgia Institute of Technology>USA>education;Ming Li+Institute of Acoustics, Chinese Academy of Sciences>CHN>facility","We propose a novel model for music structural segmentation aiming at combining harmonic and timbral information. We use two-level clustering with splitting initialization and random turbulence to produce segment labels using chroma and MFCC separately as feature. We construct a score matrix to combine segment labels from both aspects. Finally Non-negative Matrix Factorization and Maximum Likelihood are applied to extract the final segment labels. By comparing sparseness, our method is capable of automatically determining the number of segment types in a given song. The pairwise F-measure of our algorithm can reach 0.63 without rules of music knowledge, running on 180 Beatles songs. We show our model can be easily associated with more sophisticated structural segmentation algorithms and extended to probabilistic models."
78,Gabriel Sargent;Frédéric Bimbot;Emmanuel Vincent,A Regularity-Constrained Viterbi Algorithm and Its Application to The Structural Segmentation of Songs.,2011,https://doi.org/10.5281/zenodo.1415950,Gabriel Sargent+Université de Rennes 1>FRA>education;Frédéric Bimbot+CNRS>FRA>facility;Emmanuel Vincent+INRIA Rennes>FRA>facility,"""This paper presents a general approach for the structural segmentation of songs. It is formalized as a cost optimization problem that combines properties of the musical content and prior regularity assumption on the segment length. A versatile implementation of this approach is proposed by means of a Viterbi algorithm, and the design of the costs are discussed. We then present two systems derived from this approach, based on acoustic and symbolic features respectively. The advantages of the regularity constraint are evaluated on a database of 100 popular songs by showing a significant improvement of the segmentation performance in terms of F-measure."""
79,Matthias Mauch;Mark Levy,Structural Change on Multiple Time Scales as a Correlate of Musical Complexity.,2011,https://doi.org/10.5281/zenodo.1416240,Matthias Mauch+Last.fm>GBR>company;Mark Levy+Last.fm>GBR>company,"We propose the novel audio feature structural change for the analysis and visualisation of recorded music, and argue that it is related to a particular notion of musical complexity. Structural change is a meta feature that can be calculated from an arbitrary frame-wise basis feature, with each element in the structural change feature vector representing the change of the basis feature at a different time scale. We describe an efficient implementation of the feature and discuss its properties based on three basis features pertaining to harmony, rhythm and timbre. We present a novel flower-like visualisation that allows us to illustrate the overall structural change characteristics of a piece of audio in a compact way. Several examples of real-world music and synthesised audio exemplify the characteristics of the structural change feature. We present the results of a web-based listening experiment with 197 participants to show the validity of the proposed feature."
80,Yannis Panagakis;Constantine Kotropoulos;Gonzalo R. Arce,l1-Graph Based Music Structure Analysis.,2011,https://doi.org/10.5281/zenodo.1417335,Yannis Panagakis+Aristotle University of Thessaloniki>GRC>education;Constantine Kotropoulos+Aristotle University of Thessaloniki>GRC>education;Gonzalo R. Arce+University of Delaware>USA>education,"An unsupervised approach for automatic music structure analysis is proposed resorting to the following assumption: If the feature vectors extracted from a specific music segment are drawn from a single subspace, then the sequence of feature vectors extracted from a music recording will lie in a union of as many subspaces as the music segments in this recording are. It is well known that each feature vector stemming from a union of independent linear subspaces admits a sparse representation with respect to a dictionary formed by all other feature vectors with nonzero coefficients associated only to feature vectors that stem from its own subspace. Such sparse representation reveals the relationships among the feature vectors and it is used to construct a similarity graph, the so-called ℓ1-graph. Accordingly, the segmentation of audio features is obtained by applying spectral clustering to the ℓ1-graph. The performance of the just described approach is assessed by conducting experiments on the Pop-Music and the UPF Beatles benchmark datasets. Promising results are reported."
