Unnamed: 0,Authors,Title,Year,Link,Authors with Affiliations,Abstract
0,Samer M. Abdallah;Mark D. Plumbley,Polyphonic transcription by non-negative sparse coding of power spectra.,2004,https://doi.org/10.5281/zenodo.1415072,"Samer A. Abdallah+Queen Mary, University of London>GBR>education|Centre for Digital Music>GBR>facility;Mark D. Plumbley+Queen Mary, University of London>GBR>education|Centre for Digital Music>GBR>facility","We present a system for adaptive spectral basis decomposition that learns to identify independent spectral features given a sequence of short-term Fourier spectra. When applied to recordings of polyphonic piano music, the individual notes are identified as salient features, and hence each short-term spectrum is decomposed into a sum of note spectra; the resulting encoding can be used as a basis for polyphonic transcription. The system is based on a probabilistic model equivalent to a form of noisy independent component analysis (ICA) or sparse coding with non-negativity constraints. We introduce a novel modification to this model that recognises that a short-term Fourier spectrum can be thought of as a noisy realisation of the power spectral density of an underlying Gaussian process, where the noise is essentially multiplicative and non-Gaussian. Results are presented for an analysis of a live recording of polyphonic piano music."
1,Norman H. Adams;Mark A. Bartsch;Jonah Shifrin;Gregory H. Wakefield,Time Series Alignment for Music Information Retrieval.,2004,https://doi.org/10.5281/zenodo.1415694,Norman H. Adams+University of Michigan>USA>education|Unknown>Unknown>Unknown|Unknown>Unknown>Unknown;Mark A. Bartsch+University of Michigan>USA>education|Unknown>Unknown>Unknown|Unknown>Unknown>Unknown;Jonah B. Shifrin+University of Michigan>USA>education|Unknown>Unknown>Unknown|Unknown>Unknown>Unknown;Gregory H. Wakefield+University of Michigan>USA>education|Unknown>Unknown>Unknown|Unknown>Unknown>Unknown,"Time series representations are common in MIR applications such as query-by-humming, where a sung query might be represented by a series of ‘notes’ for database retrieval. While such a transcription into a sequence of (pitch, duration) pairs is convenient and musically intuitive, there is no evidence that it is an optimal representation. The present work explores three time series representations for sung queries: a sequence of notes, a ‘smooth’ pitch contour, and a novel sequence of pitch histograms. Dynamic alignment procedures are described for the three representations. Multiple continuity constraints are explored and a modified dynamic alignment procedure is described for the histogram representation. We measure the performance of the three representations using a collection of naturally sung queries applied to a target database of varying size. The results show that the note representation lends itself to rapid retrieval whereas the contour representation lends itself to robust performance. The histogram representation yields performance nearly as robust as the contour representation, but with computational complexity similar to the note representation."
2,Philippe Aigrain,Whose future is it?,2004,https://doi.org/10.5281/zenodo.1416404,Philippe Aigrain+Sopinspace>ESP>company,""""""
3,Miguel A. Alonso;Gaël Richard;Bertrand David,Tempo And Beat Estimation Of Musical Signals.,2004,https://doi.org/10.5281/zenodo.1415784,Miguel Alonso+ENST-GET>FRA>education|Unknown>Unknown>Unknown|Unknown>Unknown>Unknown;Bertrand David+ENST-GET>FRA>education|Unknown>Unknown>Unknown|Unknown>Unknown>Unknown;Gaël Richard+ENST-GET>FRA>education|Unknown>Unknown>Unknown|Unknown>Unknown>Unknown,"Tempo estimation is fundamental in automatic music processing and in many multimedia applications. This paper presents an automatic tempo tracking system that processes audio recordings and determines the beats per minute and temporal beat location. The concept of spectral energy flux is deﬁned and leads to an efﬁcient note onset detector. The algorithm involves three stages: a front-end analysis that efﬁciently extracts onsets, a periodicity detection block and the temporal estimation of beat locations. The performance of the proposed method is evaluated using a large database of 489 excerpts from several musical genres. The global recognition rate is 89.7 %. Results are discussed and compared to other tempo estimation systems."
4,Jean-Julien Aucouturier;François Pachet,Tools and Architecture for the Evaluation of Similarity Measures : Case Study of Timbre Similarity.,2004,https://doi.org/10.5281/zenodo.1416562,Jean-Julien Aucouturier+SONY CSL Paris>FRA>company|SONY CSL Paris>FRA>company;Francois Pachet+SONY CSL Paris>FRA>company|SONY CSL Paris>FRA>company,"The systematic testing of the very many parameters and algorithmic variants involved in the design of high-level music descriptors at large, and similarity measure in particular, is a daunting task, which requires the building of a general architecture which is nearly as complex as a full-fledged Music Browsing system. In this paper, we report on experiments done in an attempt to improve the performance of the music similarity measure described in [2], using the Cuidado Music Browser ([8]). We do not principally report on the actual results of the evaluation, but rather on the methodology and the various tools that were built to support such a task. We show that many non-technical browsing features are useful at various stages of the evaluation process, and in turn that some of the tools developed for the expert user can be reinjected into the Music Browser, and benefit the non-technical user."
5,Jean-Julien Aucouturier;François Pachet;Peter Hanappe,From Sound Sampling To Song Sampling.,2004,https://doi.org/10.5281/zenodo.1416028,Jean-Julien Aucouturier+SONY CSL Paris>FRA>company;Francois Pachet+SONY CSL Paris>FRA>company;Peter Hanappe+SONY CSL Paris>FRA>company,"This paper proposes to use the techniques of Music Information Retrieval in the context of Music Interaction. We describe a system, the SongSampler, inspired by the technology of audio sampling, which automatically samples a song to produce an instrument (typically using a MIDI keyboard) that plays sounds found in the original audio file. Playing with such an instrument creates an original situation in which listeners play their own music with the sounds of their favourite tunes, in a constant interaction with a music database. The paper describes the main technical issues at stake concerning the integration of music information retrieval in an interactive instrument, and reports on preliminary experiments."
6,David Bainbridge 0001;Sally Jo Cunningham;J. Stephen Downie,GREENSTONE as a Music Digital Library Toolkit.,2004,https://doi.org/10.5281/zenodo.1417573,David Bainbridge+University of Waikato>NZL>education;Sally Jo Cunningham+University of Waikato>NZL>education;J. Stephen Downie+University of Illinois>USA>education,""""""
7,David Bainbridge 0001;Sally Jo Cunningham;J. Stephen Downie,Visual Collaging Of Music In A Digital Library.,2004,https://doi.org/10.5281/zenodo.1415832,David Bainbridge+University of Waikato>NZL>education;Sally Jo Cunningham+University of Waikato>NZL>education;J. Stephen Downie+University of Illinois>USA>education,"This article explores the role visual browsing can play within a digital music library. The context to the work is provided through a review of related techniques drawn from the fields of digital libraries and human computer interaction. Implemented within the open source digital library toolkit Greenstone, a prototype system is described that combines images located through textual metadata with a visualisation technique known as collaging to provide a leisurely, undirected interaction with a music collection. Emphasis in the article is given to the augmentations of the basic technique to work in the musical domain."
8,Roberto Basili 0001;Alfredo Serafini;Armando Stellato,Classification of musical genre: a machine learning approach.,2004,https://doi.org/10.5281/zenodo.1416754,Roberto Basili+University of Rome Tor Vergata>ITA>education;Alfredo Serafini+University of Rome Tor Vergata>ITA>education;Armando Stellato+University of Rome Tor Vergata>ITA>education,"In this paper, we investigate the impact of machine learning algorithms in the development of automatic music classification models aiming to capture genres distinctions. The study of genres as bodies of musical items aggregated according to subjective and local criteria requires corresponding inductive models of such a notion. This process can be thus modeled as an example-driven learning task. We investigated the impact of different musical features on the inductive accuracy by first creating a medium-sized collection of examples for widely recognized genres and then evaluating the performances of different learning algorithms. In this work, features are derived from the MIDI transcriptions of the song collection."
9,Stephan Baumann 0001;Tim Pohle;Shankar Vembu,Towards a Socio-cultural Compatibility of MIR Systems.,2004,https://doi.org/10.5281/zenodo.1417733,Stephan Baumann+German Research Center for Artificial Intelligence>DEU>facility|Technical University of Hamburg>DEU>education;Tim Pohle+German Research Center for Artificial Intelligence>DEU>facility|Technical University of Hamburg>DEU>education;Vembu Shankar+German Research Center for Artificial Intelligence>DEU>facility|Technical University of Hamburg>DEU>education,"Future MIR systems will be of great use and pleasure for potential users. If researchers have a clear picture about their “customers” in mind they can aim at building and evaluating their systems exactly inside the different socio-cultural environments of such music listeners. Since music is in most cases embedded into a socio-cultural process we propose especially to evaluate MIR applications outside the lab during daily activities. For this purpose we designed a mobile music recommendation system relying on a trimodal music similarity metric, which allows for subjective on-the-fly adjustments of recommendations. It offers online access to large-scale metadata repositories as well as an audio database containing 1000 songs. We did first small-scale evaluations of this approach and came to interesting results regarding the perception of song similarity concerning the relations between sound, cultural issues and lyrics. Our paper will also give insights to the three different underlying approaches for song similarity computation (sound, cultural issues, lyrics), focusing in detail on a novel clustering of album reviews as found at online music retailers. Keywords: Socio-cultural issues in MIR, multimodal song similarity, ecological validation."
10,Paul Brossier;Juan Pablo Bello;Mark D. Plumbley,Fast labelling of notes in music signals.,2004,https://doi.org/10.5281/zenodo.1416132,"Paul M. Brossier+Queen Mary College, University of London>GBR>education;Juan P. Bello+Queen Mary College, University of London>GBR>education;Mark D. Plumbley+Queen Mary College, University of London>GBR>education","We present a new system for the estimation of note attributes from a live monophonic music source, within a short time delay and without any previous knowledge of the signal. The labelling is based on the temporal segmentation and the successive estimation of the fundamental frequency of the current note object. The setup, implemented around a small C library, is directed at the robust note segmentation of a variety of audio signals. A system for evaluation of performances is also presented. The further extension to polyphonic signals is considered, as well as design concerns such as portability and integration in other software environments."
11,Pedro Cano;Markus Koppenberger,The emergence of complex network patterns in music networks.,2004,https://doi.org/10.5281/zenodo.1417663,"Pedro Cano+Institut de l’Audiovisual, Universitat Pompeu Fabra>ESP>education;Markus Koppenberger+Institut de l’Audiovisual, Universitat Pompeu Fabra>ESP>education","Viewing biological, social or technological systems as networks formed by nodes and connections between them can help better understand them. We study the topology of several music networks, namely citation in allmusic.com and co-occurrence of artists in playlists. The analysis uncovers the emergence of complex network phenomena in music information networks built considering artists as nodes and its relations as links. The properties provide some hints on searchability and possible optimizations in the design of music recommendation systems. It may also provide a deeper understanding on the similarity measures that can be derived from existing music knowledge sources."
12,Michael A. Casey;Tim Crawford,Automatic Location And Measurement Of Score-based Gestures In Audio Recordings.,2004,https://doi.org/10.5281/zenodo.1415184,Michael Casey+Goldsmiths College University of London>GBR>education;Tim Crawford+Goldsmiths College University of London>GBR>education,"This paper reports on our first experiments in using the feature extraction tools of the MPEG-7 international standard for multimedia content description on a novel problem, the automatic identification and analysis of score-based performance features in audio recordings of music. Our test material consists of recordings of two pieces of 17th- and 18th-century lute music in which our aim is to recognise and isolate performance features such as trills and chord-spreadings. Using the audio tools from the MPEG-7 standard facilitates interoperability and allows us to share both score and audio metadata. As well as using low-level audio MIR techniques within this MPEG-7 context, the work has potential importance as an ‘ornamentation filter’ for MIR systems. It may also form a useful component in methods for instrumental performer identification."
13,Òscar Celma,Architecture for an MPEG-7 Web Browser.,2004,https://doi.org/10.5281/zenodo.1417229,Oscar Celma+Universitat Pompeu Fabra>ESP>education,The MPEG-7 standard provides description mechanisms and taxonomy management for multimedia documents. There are several approaches to design a multimedia database system using MPEG-7 descriptors. We discuss two of them: relational databases and native XML databases. We have implemented a search and retrieval application for MPEG-7 descriptions based on the latter.
14,Fernando William Cruz;Edilson Ferneda;Márcio da Costa P. Brandão;Evandro de Barros Costa;Hyggo Oliveira de Almeida;Murilo Bastos da Cunha;Rafael de Sousa;João Denicol;Carlos da Silva,A Brazilian Popular Music Oriented Digital Library For Musical Harmony E-Learning.,2004,https://doi.org/10.5281/zenodo.1417042,Fernando W. Cruz+Catholic University of Brasília>BRA>education;Edilson Ferneda+Catholic University of Brasília>BRA>education;Márcio Brandão+University of Brasília>BRA>education;Evandro de B. Costa+Federal University of Alagoas>BRA>education;Hyggo O. de Almeida+Federal University of Campina Grande>BRA>education;Murilo B. da Cunha+University of Brasília>BRA>education;Rafael T. de Sousa Jr.+University of Brasília>BRA>education;João Ricardo E. Denicol+Catholic University of Brasília>BRA>education;Carlos Alan P. da Silva+Federal University of Campina Grande>BRA>education,"This poster presents a digital library proposal conceived for people interested in acquiring knowledge about Brazilian popular music harmony, particularly in Choro. This Brazilian musical style is a complex popular music form based on improvisation, although it contains classical music elements such as the counterpoint. We are proposing two ways of accessing the music virtual library content: a guided navigation mode, in which users interact with a cooperative Web-based learning system; and a free navigation mode, in which users can make their own queries, both through browsers or client applications."
15,Roger B. Dannenberg;Ning Hu,Understanding Search Performance in Query-by-Humming Systems.,2004,https://doi.org/10.5281/zenodo.1416900,Roger B. Dannenberg+Carnegie Mellon University>USA>education;Ning Hu+Carnegie Mellon University>USA>education,"Previous work in Query-by-Humming systems has left open many questions. Although a variety of techniques have been explored, there has been relatively little work to compare them under controlled conditions, especially with “real” audio queries from human subjects. Previous work comparing note-interval matching, melodic contour matching, and HMM-based matching is extended with comparisons to the Phillips CubyHum algorithm and various n-gram search algorithms. We also explore the sensitivity of note-interval dynamic programming searches to different parameters and consider two-stage searches combining a fast n-gram search with a more precise but slower dynamic programming algorithm."
16,Laurent Daudet;Gaël Richard;Pierre Leveau,Methodology and Tools for the evaluation of automatic onset detection algorithms in music.,2004,https://doi.org/10.5281/zenodo.1417247,Pierre Leveau+Laboratoire d’Acoustique Musicale>FRA>facility;Laurent Daudet+Laboratoire d’Acoustique Musicale>FRA>facility;Gaël Richard+GET - ENST (Télécom Paris)>FRA>education,"This paper addresses the problem of the performance evaluation of algorithms for the automatic detection of note onsets in music signals. Our experiments show that creating a database of reference files with reliable human-annotated onset times is a complex task, since its subjective part cannot be neglected. This work provides a methodology to construct such a database. With the use of a carefully designed software tool, called SOL (Sound Onset Labellizer), we can obtain a set of reference onset times that are cross-validated amongst different expert listeners. We show that the mean error of annotated times across test subjects is very much signal-dependent. This value can be used, when evaluating automatic labelling, as an indication of the relevant tolerance window. The SOL annotation software is to be released freely for research purposes. Our test library, 17 short sequences containing about 750 onsets, comes from copyright-free music or from the public RWC database. The corresponding validated onset labels are also freely distributed, and are intended to form the starting point for the definition of a reliable benchmark."
17,Matthew E. P. Davies;Mark D. Plumbley,Causal Tempo Tracking of Audio.,2004,https://doi.org/10.5281/zenodo.1417873,Matthew E. P. Davies+Queen Mary University of London>GBR>education;Mark D. Plumbley+Queen Mary University of London>GBR>education,"We introduce a causal approach to tempo tracking for musical audio signals. Our system is designed towards an eventual real-time implementation; requiring minimal high-level knowledge of the musical audio. The tempo tracking system is divided into two sections: an onset analysis stage, used to derive a rhythmically meaningful representation from the input audio, followed by a beat matching algorithm using auto- and cross-correlative methods to generate short term predictions of future beats in the audio. The algorithm is evaluated over a range of musical styles by comparing the predicted output to beats tapped by a musician. An investigation is also presented into three rhythmically complex beat tracking problems, where the tempo is not constant. Preliminary results demonstrate good accuracy for this type of system."
18,Simon Dixon;Fabien Gouyon;Gerhard Widmer,Towards Characterisation of Music via Rhythmic Patterns.,2004,https://doi.org/10.5281/zenodo.1416220,Simon Dixon+Austrian Research Institute for AI>AUT>facility;Fabien Gouyon+Universitat Pompeu Fabra>ESP>education;Gerhard Widmer+Medical University of Vienna>AUT>education,"A central problem in music information retrieval is finding suitable representations which enable efficient and accurate computation of musical similarity and identity. Low level audio features are ideal for calculating identity, but are of limited use for similarity measures, as many aspects of music can only be captured by considering high level features. We present a new method of characterising music by typical bar-length rhythmic patterns which are automatically extracted from the audio signal, and demonstrate the usefulness of this representation by its application in a genre classification task. Recent work has shown the importance of tempo and periodicity features for genre recognition, and we extend this research by employing the extracted temporal patterns as features. Standard classification algorithms are utilised to discriminate 8 classes of Standard and Latin ballroom dance music (698 pieces). Although pattern extraction is error-prone, and patterns are not always unique to a genre, classification by rhythmic pattern alone achieves up to 50% correctness (baseline 16%), and by combining with other features, a classification rate of 96% is obtained."
19,Shyamala Doraisamy;Stefan M. Rüger,A Polyphonic Music Retrieval System Using N-Grams.,2004,https://doi.org/10.5281/zenodo.1417961,Shyamala Doraisamy+University Putra Malaysia>MYS>education;Stefan Rüger+Imperial College London>GBR>education,"This paper describes the development of a polyphonic music retrieval system with the n-gram approach. Musical n-grams are constructed from polyphonic musical performances in MIDI using the pitch and rhythm dimensions of music. These are encoded using text characters enabling the musical words generated to be indexed with existing text search engines. The Lemur Toolkit was adapted for the development of a demonstrator system on a collection of around 10,000 polyphonic MIDI performances. The indexing, search and retrieval with musical n-grams and this toolkit have been extensively evaluated through a series of experimental work over the past three years, published elsewhere. We discuss how the system works internally and describe our proposal for enhancements to Lemur towards the indexing of ‘overlaying’ as opposed to indexing a ‘bag of terms’. This includes enhancements to the parser for a ‘polyphonic musical word indexer’ to incorporate within document position information when indexing adjacent and concurrent musical words. For retrieval of these ‘overlaying’ musical words, a new proximity-based operator and a ranking function is proposed."
20,Michael Droettboom;Ichiro Fujinaga,Micro-level groundtruthing environment for OMR.,2004,https://doi.org/10.5281/zenodo.1417217,Michael Droettboom+The Johns Hopkins University>USA>education|Digital Knowledge Center>USA>facility;Ichiro Fujinaga+McGill University>CAN>education|CIRMMT>CAN>facility,"A simple framework for evaluating OMR at the symbol level is presented. While a true evaluation of an OMR system requires a high-level analysis, the automation of which is a largely unsolved problem, many high-level errors are correlated to these more tractably-analyzed lower-level errors."
21,Tuomas Eerola;Petri Toiviainen,MIR In Matlab: The MIDI Toolbox.,2004,https://doi.org/10.5281/zenodo.1416234,Tuomas Eerola+University of Jyväskylä>FIN>education;Petri Toiviainen+University of Jyväskylä>FIN>education,"""The MIDI Toolbox is a compilation of functions for analyzing and visualizing MIDI files in the Matlab computing environment. In this article, the basic issues of the Toolbox are summarized and demonstrated with examples ranging from melodic contour, similarity, key-finding, meter-finding to segmentation. The Toolbox is based on symbolic musical data but signal processing methods are applied to cover such aspects of musical behaviour as geometric representations and short-term memory. Besides simple manipulation and filtering functions, the toolbox contains cognitively inspired analytic techniques that are suitable for context-dependent musical analysis, a prerequisite for many music information retrieval applications."""
22,Jana Eggink;Guy J. Brown,Extracting Melody Lines From Complex Audio.,2004,https://doi.org/10.5281/zenodo.1418003,Jana Eggink+University of Sheffield>GBR>education;Guy J. Brown+University of Sheffield>GBR>education,"""We propose a system which extracts the melody line played by a solo instrument from complex audio. At every time frame multiple fundamental frequency (F0) hypotheses are generated, and later processing uses various knowledge sources to choose the most likely succession of F0s. Knowledge sources include an instrument recognition module and temporal knowledge about tone durations and interval transitions, which are integrated in a probabilistic search. The proposed system improved the number of frames with correct F0 estimates by 14% compared to a baseline system which simply uses the strongest F0 at every point in time. The number of spurious tones was reduced to nearly a third compared to the baseline system, resulting in significantly smoother melody lines."""
