Unnamed: 0,Authors,Title,Year,Link,Authors with Affiliations,Abstract
23,Dan Ellis;John Arroyo,Eigenrhythms: Drum pattern basis sets for classification and generation.,2004,https://doi.org/10.5281/zenodo.1415948,Daniel P. W. Ellis+Columbia University>USA>education;John Arroyo+Columbia University>USA>education,"We took a collection of 100 drum beats from popular music tracks and estimated the measure length and downbeat position of each one. Using these values, we normalized each pattern to form an ensemble of aligned drum patterns. Principal Component Analysis on this data set results in a set of basis ‘patterns’ that can be combined to give approximations and interpolations of all the examples. We use this low-dimension representation of the drum patterns as a space for classification and visualization, and discuss its application to generating continua of rhythms. Our classification results were very modest – about 20% correct on a 10-way genre classification task – but we show that the projection into principal component space reveals aspects of the rhythm that are largely orthogonal to genre but are still perceptually relevant."
24,Slim Essid;Gaël Richard;Bertrand David,Musical instrument recognition based on class pairwise feature selection.,2004,https://doi.org/10.5281/zenodo.1418253,Slim ESSID+GET-ENST (Télécom Paris)>FRA>education;Gaël RICHARD+GET-ENST (Télécom Paris)>FRA>education;Bertrand DAVID+GET-ENST (Télécom Paris)>FRA>education,"In this work, musical instrument recognition is considered on solo music from real world performance. A large sound database is used that consists of musical phrases excerpted from commercial recordings with different instrument instances, different players, and varying recording conditions. The proposed recognition scheme exploits class pairwise feature selection based on inertia ratio maximization. Moreover, new signal processing features based on octave band energy measures are introduced that prove to be useful. Classification is performed using Gaussian Mixture Models in a one vs one fashion in association with a data rescaling procedure as pre-processing. Experimental results show that substantial improvement in recognition success is thus achieved."
25,Klaus Frieler,Beat and meter extraction using gaussified onsets.,2004,https://doi.org/10.5281/zenodo.1417851,Klaus Frieler+University of Hamburg>DEU>education,"Rhythm, beat and meter are key concepts of music in general. Many efforts had been made in the last years to automatically extract beat and meter from a piece of music given either in audio or symbolical representation (see e.g. [11] for an overview). In this paper we propose a new method for extracting beat, meter and phase information from a list of unquantized onset times. The procedure relies on a novel method called ’Gaussiﬁcation’ and adopts correlation techniques combined with findings from music psychology for parameter settings."
26,Emilia Gómez;Perfecto Herrera,Estimating The Tonality Of Polyphonic Audio Files: Cognitive Versus Machine Learning Modelling Strategies.,2004,https://doi.org/10.5281/zenodo.1418007,Emilia Gómez+Universitat Pompeu Fabra>ESP>education;Perfecto Herrera+Universitat Pompeu Fabra>ESP>education,"In this paper we evaluate two methods for key estimation from polyphonic audio recordings. Our goal is to compare between a strategy using a cognition-inspired model and several machine learning techniques to find a model for tonality (mode and key note) determination of polyphonic music from audio files. Both approaches have as an input a vector of values related to the intensity of each of the pitch classes of a chromatic scale. In this study, both methods are explained and evaluated in a large database of audio recordings of classical pieces."
27,Masataka Goto;Katunobu Itou;Koji Kitayama;Tetsunori Kobayashi,Speech-Recognition Interfaces for Music Information Retrieval: 'Speech Completion' and 'Speech Spotter'.,2004,https://doi.org/10.5281/zenodo.1417339,Masataka Goto+National Institute of Advanced Industrial Science and Technology (AIST)>JPN>facility|Waseda University>JPN>education;Katunobu Itou+Nagoya University>JPN>education;Koji Kitayama+National Institute of Advanced Industrial Science and Technology (AIST)>JPN>facility|Waseda University>JPN>education;Tetsunori Kobayashi+National Institute of Advanced Industrial Science and Technology (AIST)>JPN>facility|Waseda University>JPN>education,"This paper describes music information retrieval (MIR) systems featuring automatic speech recognition. Although various interfaces for MIR have been proposed, speech-recognition interfaces suitable for retrieving musical pieces have not been studied. We propose two different speech-recognition interfaces for MIR, speech completion and speech spotter, and describe two MIR-based hands-free jukebox systems that enable a user to retrieve and play back a musical piece by saying its title or the artist’s name. The first is a music-retrieval system with the speech-completion interface that is suitable for music stores and car-driving situations. When a user can remember only part of the name of a musical piece or an artist and utters only a remembered fragment, the system helps the user recall and enter the name by completing the fragment. The second is a background-music playback system with the speech-spotter interface that can enrich human-human conversation. When a user is talking to another person, the system allows the user to enter voice commands for music-playback control by spotting a special voice-command utterance in face-to-face or telephone conversations. Our experimental results from use of these systems have demonstrated the effectiveness of the speech-completion and speech-spotter interfaces."
28,Fabien Gouyon;Simon Dixon,Dance music classification: A tempo-based approach.,2004,https://doi.org/10.5281/zenodo.1416636,Fabien Gouyon+Universitat Pompeu Fabra>ESP>education|Austrian Research Institute for AI>AUT>facility;Simon Dixon+Austrian Research Institute for AI>AUT>facility,"Recent research has studied the relevance of various features for automatic genre classification, showing the particular importance of tempo in dance music classification. We complement this work by considering a domain-specific learning methodology, where the computed tempo is used to select an expert classifier which has been specialized on its own tempo range. This enables the all-class learning task to be reduced to a set of two- and three-class learning tasks. Current results are around 70% classification accuracy (8 ballroom dance music classes, 698 instances, baseline 15.9%)."
29,Maarten Grachten;Josep Lluís Arcos;Ramón López de Mántaras,Melodic Similarity: Looking for a Good Abstraction Level.,2004,https://doi.org/10.5281/zenodo.1417403,Maarten Grachten+IIIA-CSIC - Artificial Intelligence Research Institute>ESP>facility|CSIC - Spanish Council for Scientific Research>ESP>facility;Josep-Lluís Arcos+IIIA-CSIC - Artificial Intelligence Research Institute>ESP>facility|CSIC - Spanish Council for Scientific Research>ESP>facility;Ramon López de Mántaras+IIIA-CSIC - Artificial Intelligence Research Institute>ESP>facility|CSIC - Spanish Council for Scientific Research>ESP>facility,"Computing melodic similarity is a very general problem with diverse musical applications ranging from music analysis to content-based retrieval. Choosing the appropriate level of representation is a crucial issue and depends on the type of application. Our research interest concerns the development of a CBR system for expressive music processing. In that context, a well chosen distance measure for melodies is a crucial issue. In this paper we propose a new melodic similarity measure based on the I/R model for melodic structure and compare it with other existing measures. The experimentation shows that the proposed measure provides a good compromise between discriminatory power and ability to recognize phrases from the same song."
30,Matthias Gruhne;Christian Uhle;Christian Dittmar;Markus Cremer,Extraction of Drum Patterns and their Description within the MPEG-7 High-Level-Framework.,2004,https://doi.org/10.5281/zenodo.1414888,Matthias Gruhne+Fraunhofer IDMT>DEU>facility;Christian Uhle+Fraunhofer IDMT>DEU>facility;Christian Dittmar+Fraunhofer IDMT>DEU>facility;Markus Cremer+Fraunhofer IDMT>DEU>facility,"A number of metadata standards have been published in recent years due to the increasing availability of multimedia content and the resulting issue of sorting and retrieving this content. One of the most recent efforts for a well defined metadata description is the ISO/IEC MPEG-7 standard, which takes a very broad approach towards the definition of metadata. Herein, not merely hand annotated textual information can be transported and stored, but also more signal specific data that can in most cases be automatically retrieved from the multimedia content itself. In this publication an algorithm for the automated transcription of rhythmic (percussive) accompaniment in modern day popular music is described. However, the emphasis here is not a precise transcription, but on capturing the “rhythmic gist” of the piece of music in order to allow a more abstract comparison of musical pieces by their dominant rhythmic patterns. A small-scale evaluation of the algorithm is presented along with an example representation of the thus gained semantically meaningful metadata using description methods currently discussed within MPEG-7."
31,AnYuan Guo;Hava T. Siegelmann,Time-Warped Longest Common Subsequence Algorithm for Music Retrieval.,2004,https://doi.org/10.5281/zenodo.1417165,An Yuan Guo+University of Massachusetts>USA>education;Hava Siegelmann+University of Massachusetts>USA>education,"Recent advances in music information retrieval have enabled users to query a database by singing or humming into a microphone. The queries are often inaccurate versions of the original songs due to singing errors and errors introduced in the music transcription process. In this paper, we present the Time-Warped Longest Common Subsequence algorithm (T-WLCS), which deals with singing errors involving rhythmic distortions. The algorithm is employed on song retrieval tasks, where its performance is compared to the longest common subsequence algorithm."
32,Jin Ha Lee;J. Stephen Downie,"Survey Of Music Information Needs, Uses, And Seeking Behaviours: Preliminary Findings.",2004,https://doi.org/10.5281/zenodo.1417637,Jin Ha Lee+University of Illinois at Urbana-Champaign>USA>education;J. Stephen Downie+University of Illinois at Urbana-Champaign>USA>education,"User studies focusing upon real-life music information needs, uses and seeking behaviours are still very scarce in the music information retrieval (MIR) and music digital library (MDL) fields. We are conducting a multi-group survey in an attempt to acquire information that can help eradicate false assumptions in designing MIR systems. Our goal is to provide an empirical basis for MIR/MDL system development. In this paper, we present our preliminary findings and analyses based on the 427 user responses we have received to date. Two major themes have been uncovered thus far that could have a significant influence the future development of successful MIR/MDL systems. First, people display “public information-seeking” behaviours by making use of collective knowledge and/or opinions of others about music such as reviews, ratings, recommendations, etc. in their music information-seeking. Second, respondents expressed needs for contextual metadata in addition to traditional bibliographic metadata."
33,Pierre Hanna;Nicolas Louis;Myriam Desainte-Catherine;Jenny Benois-Pineau,Audio Features for Noisy Sound Segmentation.,2004,https://doi.org/10.5281/zenodo.1415214,Pierre Hanna+SCRIME - LaBRI>FRA>facility|Université de Bordeaux 1>FRA>education;Nicolas Louis+SCRIME - LaBRI>FRA>facility|Université de Bordeaux 1>FRA>education;Myriam Desainte-Catherine+SCRIME - LaBRI>FRA>facility|Université de Bordeaux 1>FRA>education;Jenny Benois-Pineau+SCRIME - LaBRI>FRA>facility|Université de Bordeaux 1>FRA>education,"Automatic audio classification usually considers sounds as music, speech, silence or noise, but works about the noise class are rare. Audio features are generally specific to speech or music signals. In this paper, we present a new audio feature sets that lead to the definition of four classes: colored, pseudo-periodic, impulsive and sinusoids within noises. This classification relies on works about the perception of noises. This audio feature set is experimented for noisy sound segmentation. Noise-to-noise transitions are characterized by means of statistical decision model based on Bayesian framework. This statistical method has been trained and experimented both on synthetic and real audio corpus. Using proposed feature set increases the discriminant power of Bayesian decision approach compared to a usual feature set."
34,David Hirst,An Analytical Methodology for Acousmatic Music.,2004,https://doi.org/10.5281/zenodo.1415656,David Hirst+University of Melbourne>AUS>education,"This paper presents a procedure for the analysis of acousmatic music which was derived from the synthesis of top-down (knowledge driven) and bottom-up (data-driven) cognitive psychological views. The procedure is also a synthesis of research on primitive auditory scene analysis, combined with the research on acoustic, semantic, and syntactic factors in the perception of everyday environmental sounds. The procedure can be summarized as consisting of a number of steps: Segregation of sonic objects; Horizontal integration and/or segregation; Vertical integration and/or segregation; Assimilation and meaning."
35,Robyn Holmes;Marie-Louise Ayres,MusicAustralia: towards a national music information infrastructure.,2004,https://doi.org/10.5281/zenodo.1418097,Robyn Holmes+National Library of Australia>AUS>facility;Marie-Louise Ayres+National Library of Australia>AUS>facility,"MusicAustralia is a national music discovery service, developed by the National Library of Australia and ScreenSound Australia, National Film and Sound Archive. The service aims to provide seamless access to music and music information resources, in multiple formats, from custodians across all cultural sectors. This paper describes the development of the service, including its architecture, and content base. Service development to date has concentrated on metadata contribution and discovery strategies, together with development of the national digital music collection. In the future, digital content developed to populate the service could be subjected to Music Information Retrieval applications, to further enrich understanding of Australian music. The paper finishes by examining the challenges of achieving these advanced services in an environment where MIR research is relatively undeveloped."
36,Jia-Lien Hsu;Arbee L. P. Chen;Hung-Chen Chen,Finding Approximate Repeating Patterns from Sequence Data.,2004,https://doi.org/10.5281/zenodo.1415530,Jia-Lien Hsu+Fu Jen Catholic University>TWN>education;Arbee L.P. Chen+National Chengchi University>TWN>education;Hung-Chen Chen+National Tsing Hua University>TWN>education,"In this paper, an application of feature extraction from music data is first introduced to motivate our research of finding approximate repeating patterns from sequence data. An approximate repeating pattern is defined as a sequence of symbols which appears more than once under certain approximation types in a data sequence. By using the ‘cut’ and ‘pattern_join’ operators, we develop a level-wise approach to solve the problem of finding approximate repeating patterns."
37,Akinori Ito;Sung-Phil Heo;Motoyuki Suzuki;Shozo Makino,Comparison Of Features For DP-Matching Based Query-by-Humming System.,2004,https://doi.org/10.5281/zenodo.1416178,Akinori Ito+Tohoku University>JPN>education|Korea Telecom Research & Development Group>KOR>company;Sung-Phil Heo+Korea Telecom Research & Development Group>KOR>company|Tohoku University>JPN>education;Motoyuki Suzuki+Tohoku University>JPN>education;Shozo Makino+Tohoku University>JPN>education,"In this paper, we compared three kinds of similarity measures for DP-matching based query-by-humming music retrieval experiments. First, a DP matching-based algorithm is formulated using the similarity between a deltaPitch of an input humming and that of a song in the database. Then the three similarities are introduced: distance-based similarity, quantization-based similarity and fuzzy quantization-based similarity. The three similarities are compared by experiments. From the experimental results, the distance-based one gave the best recall rate. In addition, we examined the combination of distance-based and fuzzy-quantization-based similarities. The experimental result showed that the recall rate was improved by the combination."
38,Peter Jan O. Doets;Reginald L. Lagendijk,Stochastic Model of a Robust Audio Fingerprinting System.,2004,https://doi.org/10.5281/zenodo.1416490,P.J.O. Doets+Delft University of Technology>NLD>education;R.L. Lagendijk+Delft University of Technology>NLD>education,"An audio fingerprint is a compact representation of the perceptually relevant parts of audio content. A suitable audio fingerprint can be used to identify audio files, even if they are severely degraded due to compression or other types of signal processing operations. When degraded, the fingerprint closely resembles the fingerprint of the original, but is not identical. We plan to use a fingerprint not only to identify the song but also to assess the perceptual quality of the compressed content. In order to develop such a fingerprinting scheme, a model is needed to assess the behavior of a fingerprint subject to compression. In this paper we present the initial outlines of a model for an existing robust fingerprinting system to develop a more theoretical foundation. The model describes the stochastic behavior of the system when the input signal is a stationary (stochastic) signal. In this paper the input is assumed to be white noise. Initial theoretical results are reported and validated with experimental data."
39,Tristan Jehan,Perceptual Segment Clustering For Music Description And Time-axis Redundancy Cancellation.,2004,https://doi.org/10.5281/zenodo.1416854,Tristan Jehan+Massachusetts Institute of Technology>USA>education,"Repeating sounds and patterns are widely exploited throughout music. However, although analysis and music information retrieval applications are often concerned with processing speed and music description, they typically discard the benefits of sound redundancy cancellation. We propose a perceptually grounded model for describing music as a sequence of labeled sound segments, for reducing data complexity, and for compressing audio."
40,Steve Jones;Sally Jo Cunningham;Matt Jones 0001,Organizing digital music for use: an examination of personal music collections.,2004,https://doi.org/10.5281/zenodo.1416298,Sally Jo Cunningham+University of Waikato>NZL>education|Unknown>Unknown>Unknown|Unknown>Unknown>Unknown;Matt Jones+University of Waikato>NZL>education|Unknown>Unknown>Unknown|Unknown>Unknown>Unknown;Steve Jones+University of Waikato>NZL>education|Unknown>Unknown>Unknown|Unknown>Unknown>Unknown,"Current research on music information retrieval and music digital libraries focuses on providing access to huge, public music collections. In this paper we consider a different, but related, problem: supporting an individual in maintaining and using a personal music collection. We analyze organization and access techniques used to manage personal music collections (primarily CDs and MP3 files), and from these behaviors, to suggest user behaviors that should be supported in a personal music digital library (that is, a digital library of an individual’s personal music collection)."
41,Jürgen Kilian;Holger H. Hoos,MusicBLAST - Gapped Sequence Alignment for MIR.,2004,https://doi.org/10.5281/zenodo.1416984,Jürgen Kilian+Darmstadt University of Technology>DEU>education|University of British Columbia>CAN>education;Holger H. Hoos+University of British Columbia>CAN>education,"We propose an algorithm, MusicBLAST, for approximate pattern search/matching on symbolic musical data. MusicBLAST is based on the BLAST algorithm, one of the most commonly used algorithms for similarity search on biological sequence data. MusicBLAST can be used in combination with an arbitrary similarity measure (e.g., melodic, rhythmic or combined) and retrieves multiple occurrences of a given search pattern and its variations. Different from many other pattern matching techniques, it can find incomplete and imperfect occurrences of a given pattern, and produces a significance measure for the accuracy and quality of its results. Like BLAST — and different from many musical pattern matching approaches — MusicBLAST retrieves heuristically optimised bi-directional alignments searching iteratively in forward and backward direction by starting at a dedicated seed note position of a performance."
42,Peter Knees;Elias Pampalk;Gerhard Widmer,Artist Classification with Web-Based Data.,2004,https://doi.org/10.5281/zenodo.1417189,Peter Knees+Austrian Research Institute for Artificial Intelligence>AUT>facility;Elias Pampalk+Austrian Research Institute for Artificial Intelligence>AUT>facility;Gerhard Widmer+Austrian Research Institute for Artificial Intelligence>AUT>facility|Medical University of Vienna>AUT>education,"Manifold approaches exist for organization of music by genre and/or style. In this paper we propose the use of text categorization techniques to classify artists present on the Internet. In particular, we retrieve and analyze webpages ranked by search engines to describe artists in terms of word occurrences on related pages. To classify artists we primarily use support vector machines. We present 3 experiments in which we address the following issues. First, we study the performance of our approach compared to previous work. Second, we investigate how daily fluctuations in the Internet affect our approach. Third, on a set of 224 artists from 14 genres we study (a) how many artists are necessary to define the concept of a genre, (b) which search engines perform best, (c) how to formulate search queries best, (d) which overall performance we can expect for classification, and finally (e) how our approach is suited as a similarity measure for artists."
43,Ian Knopke,"Sound, Music and Textual Associations on the World Wide Web.",2004,https://doi.org/10.5281/zenodo.1416144,Ian Knopke+McGill University>CAN>education,"Sound files on the World Wide Web are accessed from web pages. To date, this relationship has not been explored extensively in the MIR literature. This paper details a series of experiments designed to measure the similarity between the public text visible on a web page and the linked sound files, the name of which is normally unseen by the user. A collection of web pages was retrieved from the web using a specially-constructed crawler. Sound file information and associated text were parsed from the pages and analyzed for similarity using common IR techniques such as TFIDF cosine measures. The results are intended to be used in the improvement of a web crawler for audio and music, as well as for MIR purposes in general."
44,Arvindh Krishnaswamy,Melodic Atoms for Transcribing Carnatic Music.,2004,https://doi.org/10.5281/zenodo.1417859,Arvindh Krishnaswamy+Center for Computer Research in Music and Acoustics>USA>facility,"We had introduced a set of 2D melodic units to transcribe Carnatic music previously, and we now provide some illustrative examples using real pitch tracks to further our discussion on this topic."
45,Pedro Kröger,CsoundXML: a meta-language in XML for sound synthesis.,2004,https://doi.org/10.5281/zenodo.1415652,Pedro Kröger+Federal University at Bahia>BRA>education,"The software sound synthesis is closely related to the Music N programs started with Music I in 1957. Although Music N has many advantages such as unit generators and a flexible score language, it presents a few problems like limitations on instrument reuse, inflexibility of use of parameters, lack of a built-in graphical interface, and usually only one paradigm for scores. Some solutions concentrate in new from-scratch Music N implementations, while others focus in building user tools like pre-processors and graphical utilities. Nevertheless, new implementations in general focus in specific groups of problems leaving others unsolved. The user tools solve only one problem with no connection with others. In this paper we investigate the problem of creating a meta-language for sound synthesis. This constitutes an elegant solution for the above cited problems, without the need of a yet new acoustic compiler implementation, allowing a tight integration which is difficult to obtain with the present user tools."
